venue,year,paper_type,is_proceedings_track,title,speakers,authors,affiliations,arxiv_ids,session_name,scheduled_date,scheduled_time,duration_minutes,presentation_url,video_url,youtube_id,award,notes
TQC,2024,regular,TRUE,Multi-qubit Lattice Surgery Scheduling,Allyson Silva; Xiangyi Zhang; Zak Webb; Mia Kramer; Chan-Woo Yang; Xiao Liu; Jessica Lemieux; Ka-Wai Chen; Artur Scherer; Pooya Ronagh,Allyson Silva; Xiangyi Zhang; Zak Webb; Mia Kramer; Chan-Woo Yang; Xiao Liu; Jessica Lemieux; Ka-Wai Chen; Artur Scherer; Pooya Ronagh,,,Proceedings track (LIPIcs),,,,https://drops.dagstuhl.de/storage/00lipics/lipics-vol310-tqc2024/LIPIcs.TQC.2024.1/LIPIcs.TQC.2024.1.pdf,,,,DOI: 10.4230/LIPIcs.TQC.2024.1; LIPIcs proceedings (Dagstuhl)
TQC,2024,regular,TRUE,Stochastic Error Cancellation in Analog Quantum Simulation,Yiyi Cai; Yu Tong; John Preskill,Yiyi Cai; Yu Tong; John Preskill,,,Proceedings track (LIPIcs),,,,https://drops.dagstuhl.de/storage/00lipics/lipics-vol310-tqc2024/LIPIcs.TQC.2024.2/LIPIcs.TQC.2024.2.pdf,,,,DOI: 10.4230/LIPIcs.TQC.2024.2; LIPIcs proceedings (Dagstuhl)
TQC,2024,regular,TRUE,Efficient Optimal Control of Open Quantum Systems,Wenhao He; Tongyang Li; Xiantao Li; Zecheng Li; Chunhao Wang; Ke Wang,Wenhao He; Tongyang Li; Xiantao Li; Zecheng Li; Chunhao Wang; Ke Wang,,,Proceedings track (LIPIcs),,,,https://drops.dagstuhl.de/storage/00lipics/lipics-vol310-tqc2024/LIPIcs.TQC.2024.3/LIPIcs.TQC.2024.3.pdf,,,,DOI: 10.4230/LIPIcs.TQC.2024.3; LIPIcs proceedings (Dagstuhl)
TQC,2024,regular,TRUE,One-Wayness in Quantum Cryptography,Tomoyuki Morimae; Takashi Yamakawa,Tomoyuki Morimae; Takashi Yamakawa,,,Proceedings track (LIPIcs),,,,https://drops.dagstuhl.de/storage/00lipics/lipics-vol310-tqc2024/LIPIcs.TQC.2024.4/LIPIcs.TQC.2024.4.pdf,,,,DOI: 10.4230/LIPIcs.TQC.2024.4; LIPIcs proceedings (Dagstuhl)
TQC,2024,regular,TRUE,Revocable Quantum Digital Signatures,Tomoyuki Morimae; Alexander Poremba; Takashi Yamakawa,Tomoyuki Morimae; Alexander Poremba; Takashi Yamakawa,,,Proceedings track (LIPIcs),,,,https://drops.dagstuhl.de/storage/00lipics/lipics-vol310-tqc2024/LIPIcs.TQC.2024.5/LIPIcs.TQC.2024.5.pdf,,,,DOI: 10.4230/LIPIcs.TQC.2024.5; LIPIcs proceedings (Dagstuhl)
TQC,2024,regular,TRUE,The Quantum Decoding Problem,André Chailloux; Jean-Pierre Tillich,André Chailloux; Jean-Pierre Tillich,,,Proceedings track (LIPIcs),,,,https://drops.dagstuhl.de/storage/00lipics/lipics-vol310-tqc2024/LIPIcs.TQC.2024.6/LIPIcs.TQC.2024.6.pdf,,,,DOI: 10.4230/LIPIcs.TQC.2024.6; LIPIcs proceedings (Dagstuhl)
TQC,2024,regular,TRUE,Eigenpath Traversal by Poisson-Distributed Phase Randomisation,Joseph Cunningham; Jérémie Roland,Joseph Cunningham; Jérémie Roland,,,Proceedings track (LIPIcs),,,,https://drops.dagstuhl.de/storage/00lipics/lipics-vol310-tqc2024/LIPIcs.TQC.2024.7/LIPIcs.TQC.2024.7.pdf,,,,DOI: 10.4230/LIPIcs.TQC.2024.7; LIPIcs proceedings (Dagstuhl)
TQC,2024,regular,TRUE,(Quantum) Complexity of Testing Signed Graph Clusterability,Kuo-Chin Chen; Simon Apers; Min-Hsiu Hsieh,Kuo-Chin Chen; Simon Apers; Min-Hsiu Hsieh,,,Proceedings track (LIPIcs),,,,https://drops.dagstuhl.de/storage/00lipics/lipics-vol310-tqc2024/LIPIcs.TQC.2024.8/LIPIcs.TQC.2024.8.pdf,,,,DOI: 10.4230/LIPIcs.TQC.2024.8; LIPIcs proceedings (Dagstuhl)
TQC,2024,regular,TRUE,Quantum Non-Identical Mean Estimation: Efficient Algorithms and Fundamental Limits,Jiachen Hu; Tongyang Li; Xinzhao Wang; Yecheng Xue; Chenyi Zhang; Han Zhong,Jiachen Hu; Tongyang Li; Xinzhao Wang; Yecheng Xue; Chenyi Zhang; Han Zhong,,,Proceedings track (LIPIcs),,,,https://drops.dagstuhl.de/storage/00lipics/lipics-vol310-tqc2024/LIPIcs.TQC.2024.9/LIPIcs.TQC.2024.9.pdf,,,,DOI: 10.4230/LIPIcs.TQC.2024.9; LIPIcs proceedings (Dagstuhl)
TQC,2024,regular,TRUE,Guidable Local Hamiltonian Problems with Implications to Heuristic Ansatz State Preparation and the Quantum PCP Conjecture,Jordi Weggemans; Marten Folkertsma; Chris Cade,Jordi Weggemans; Marten Folkertsma; Chris Cade,,,Proceedings track (LIPIcs),,,,https://drops.dagstuhl.de/storage/00lipics/lipics-vol310-tqc2024/LIPIcs.TQC.2024.10/LIPIcs.TQC.2024.10.pdf,,,,DOI: 10.4230/LIPIcs.TQC.2024.10; LIPIcs proceedings (Dagstuhl)
TQC,2024,regular,TRUE,A Direct Reduction from the Polynomial to the Adversary Method,Aleksandrs Belovs,Aleksandrs Belovs,,,Proceedings track (LIPIcs),,,,https://drops.dagstuhl.de/storage/00lipics/lipics-vol310-tqc2024/LIPIcs.TQC.2024.11/LIPIcs.TQC.2024.11.pdf,,,,DOI: 10.4230/LIPIcs.TQC.2024.11; LIPIcs proceedings (Dagstuhl)
TQC,2024,regular,TRUE,Quantum Delegation with an Off-The-Shelf Device,Anne Broadbent; Arthur Mehta; Yuming Zhao,Anne Broadbent; Arthur Mehta; Yuming Zhao,,,Proceedings track (LIPIcs),,,,https://drops.dagstuhl.de/storage/00lipics/lipics-vol310-tqc2024/LIPIcs.TQC.2024.12/LIPIcs.TQC.2024.12.pdf,,,,DOI: 10.4230/LIPIcs.TQC.2024.12; LIPIcs proceedings (Dagstuhl)
