venue,year,paper_type,title,speakers,authors,affiliations,abstract,arxiv_ids,presentation_url,video_url,youtube_id,session_name,award,notes,scheduled_date,scheduled_time,duration_minutes
TQC,2011,regular,Telescopic Relative Entropy,Koenraad M.R. Audenaert,Koenraad M.R. Audenaert,"Department of Mathematics, Royal Holloway, University of London","The quantum relative entropy between two quantum states rho and sigma, S(rho||sigma) = Tr rho(log rho - log sigma), is a non-commutative generalisation of the Kullback-Leibler distance between probability distributions. Because of its strong mathematical connections with von Neumann entropy, and its interpretation as an optimal asymptotic error rate in quantum hypothesis testing (in the context of Stein's lemma) relative entropy is widely used as a (non-symmetric) distance measure between states. One of its drawbacks, however, is that for non-faithful (rank-deficient) states the relative entropy can be infinite. We define the telescopic relative entropy (TRE) and prove sharp upper bounds on it in terms of the trace norm distance.",,,,,Quantum Information I,,Springer LNCS 6745; source_type=claude_extraction,2011-05-24,16:00,30
TQC,2011,regular,Large Violation of Bell Inequalities Using Both Particle and Wave Measurements,Daniel Cavalcanti,Daniel Cavalcanti; Nicolas Brunner; Paul Skrzypczyk; Alejo Salles; Valerio Scarani,"Centre for Quantum Technologies, National University of Singapore; H.H. Wills Physics Laboratory, University of Bristol; Niels Bohr Institute, Copenhagen","When separated measurements on entangled quantum systems are performed, the theory predicts correlations that cannot be explained by any classical mechanism. All optical demonstrations of such violations have involved discrete degrees of freedom and are plagued by the detection-efficiency loophole. We present a simple method for generating large violations for feasible states using both photon counting and homodyne detections. Our scheme may lead to the first violation of Bell inequalities using continuous-variable measurements and pave the way for a loophole-free Bell test.",1012.1916,,,,Quantum Cryptography II,,Talk in proceedings book of abstracts but not in Springer LNCS 6745; source_type=claude_extraction,2011-05-25,15:00,30
TQC,2011,regular,Local Unitary Group Stabilizers and Entanglement for Multiqubit Symmetric States,Curt D. Cenci,Curt D. Cenci; David W. Lyons; Scott N. Walck,"Mathematical Sciences, Lebanon Valley College; Physics, Lebanon Valley College","We refine recent local unitary entanglement classification for symmetric pure states of n qubits (that is, states invariant under permutations of qubits) using local unitary stabilizer subgroups and Majorana configurations.",,,,,Quantum Information II,,Springer LNCS 6745; source_type=claude_extraction,2011-05-26,16:00,30
TQC,2011,regular,The Locking-Decoding Frontier for Generic Dynamics,Frédéric Dupuis,Frédéric Dupuis; Jan Florjanczyk; Patrick Hayden; Debbie Leung,"Institute for Theoretical Physics, ETH Zurich; School of Computer Science, McGill University; Institute for Quantum Computing, University of Waterloo; Perimeter Institute for Theoretical Physics","One of the most basic and intuitive properties of most information measures is that the amount of information carried by a physical system must be bounded by its size. We consider locking, which occurs when classical information encoded into a quantum system can be extracted given access to the cyphertext only with much less probability than expected. We show that locking occurs with high probability in physical systems whose internal dynamics are sufficiently random, with implications for thermodynamics and the black hole information problem. We also generalise locking to the case where the measuring device is allowed to share entanglement with the cyphertext-key compound system.",,,,,Quantum Information I,,Springer LNCS 6745; source_type=claude_extraction,2011-05-24,15:00,30
TQC,2011,regular,Unconditionally-Secure and Reusable Public-Key Authentication,Lawrence M. Ioannou,Lawrence M. Ioannou; Michele Mosca,"Institute for Quantum Computing, University of Waterloo; Department of Combinatorics and Optimization, University of Waterloo; Perimeter Institute for Theoretical Physics","Public-key cryptography has proved to be an indispensable tool in the modern information security infrastructure. We prove that an identification scheme based on bounded quantum reference frames is secure against a computationally-unbounded adversary (only restricted by finite cheating strategies), demonstrating for the first time that unconditionally-secure and reusable public-key authentication is possible in principle. To prove security of our protocol, we employ elements of the polynomial method, the theory of estimation of black-box group transformations, and the theory of bounded quantum reference frames. We also use the quantum Fourier transform in a new and rather surprising way.",,,,,Quantum Cryptography II,,Springer LNCS 6745; source_type=claude_extraction,2011-05-25,16:00,30
TQC,2011,regular,Approximating the Turaev-Viro Invariant of Mapping Tori is Complete for One Clean Qubit,Stephen P. Jordan,Stephen P. Jordan; Gorjan Alagic,"Institute for Quantum Information, Caltech; Institute for Quantum Computing, University of Waterloo","In 1998, Knill and Laflamme proposed that exponential speedups over classical computers could still be possible even if one can only initialize a single qubit into a pure state, with the rest of the qubits in the maximally mixed state. The complexity class thus defined is called DQC1. We show that approximating the Turaev-Viro invariant of a 3-manifold specified as a mapping torus is a complete problem for DQC1. We also use the language of Topological Quantum Field Theories (or TQFTs) to outline the mathematical underpinnings of the relationship between approximating the Jones polynomial of the plat and trace closures, and approximating the Turaev-Viro invariant of Heegaard splittings and mapping tori.",,,,,Quantum Algorithms I,,Springer LNCS 6745; source_type=claude_extraction,2011-05-25,10:30,30
TQC,2011,regular,Long Distance Quantum Key Distribution with Continuous Variables,Anthony Leverrier,Anthony Leverrier; Philippe Grangier,"ICFO-Institut de Ciències Fotòniques; Institut Telecom / Telecom ParisTech, CNRS LTCI; Laboratoire Charles Fabry, Institut d'Optique, CNRS, Univ. Paris-Sud","Quantum key distribution (QKD) is a cryptographic primitive allowing two distant parties, Alice and Bob, to establish a secret key in an untrusted environment controlled by some eavesdropper, Eve. We introduce a new continuous-variable QKD protocol using a continuous but non-Gaussian modulation, allowing for an efficient reconciliation scheme and thus for improved performances. The modulation we consider crucially uses algebraic properties of the octonions, which can be seen as points on the unit sphere in R^8. We establish the security of this protocol against collective attacks, provided that the quantum channel is linear.",,,,,Quantum Cryptography II,,Springer LNCS 6745; source_type=claude_extraction,2011-05-25,16:30,30
TQC,2011,regular,Quantum Discord in Quantum Information Theory - From Strong Subadditivity to the Mother Protocol,Vaibhav Madhok,Vaibhav Madhok; Animesh Datta,"Center for Quantum Information and Control, University of New Mexico; Clarendon Laboratory, Department of Physics, University of Oxford","There exist instances of computations involving mixed quantum states where the quantum advantages over the best known classical algorithm cannot be ascribed to quantum entanglement. We present a fundamental role played by quantum discord in quantum information processing. One of our main results is a connection between quantum discord and the strong subadditivity of von Neumann entropy. Our second main result gives an operational interpretation of quantum discord by establishing its role in an important class of quantum information protocols. We show that quantum discord measures how coherently one performs the Mother protocol, and its generalization as the FQSW (Fully quantum Slepian Wolf) protocol, in the presence of decoherence.",,,,,Quantum Information II,,Springer LNCS 6745; source_type=claude_extraction,2011-05-26,15:30,30
TQC,2011,regular,Information-Theoretic Approach to the Study of Symmetric Dynamics,Iman Marvian,Iman Marvian; Robert W. Spekkens,"Perimeter Institute for Theoretical Physics; Institute for Quantum Computing, University of Waterloo","Finding the consequences of symmetries in dynamics is a subject with broad applications in physics. We are interested to find tools to study the consequences of symmetry which apply to open as well as closed quantum systems. We introduce a different point of view for thinking about asymmetry which is not based on symmetric dynamics; instead it is based on the intuition that a state which breaks symmetry can be thought as a signal which carries information about the group element. Using this point of view we use information measures to build asymmetry measures via the Holevo quantity. We show that for pure states Noether's theorem includes all the possible implications of the symmetry of dynamics, but for mixed states conservation of asymmetry measures imply more constraints than those prescribed by Noether's theorem.",,,,,Quantum Information I,,Talk in proceedings book of abstracts but not in Springer LNCS 6745; talk title in program: A generalization of Noether's theory and the information-theoretic approach to the study of symmetric dynamics; source_type=claude_extraction,2011-05-24,16:30,30
TQC,2011,regular,Secure Device-Independent Quantum Key Distribution with Causally Independent Measurement Devices,Lluís Masanes,Lluís Masanes; Stefano Pironio; Antonio Acín,"ICFO-Institut de Ciències Fotòniques; Laboratoire d'Information Quantique, Université Libre de Bruxelles; ICREA-Institució Catalana de Recerca i Estudis Avançats","Device-independent quantum key distribution aims to provide key distribution schemes whose security is based on the laws of quantum physics but which does not require any assumptions about the internal working of the quantum devices used in the protocol. We provide a general security proof valid for a large class of device-independent quantum key distribution protocols in a model in which the raw key elements are generated by causally independent measurement processes. The validity of this independence condition may be justifiable in a variety of implementations and is necessarily satisfied in a physical realization where the raw key is generated by N separate pairs of devices.",,,,,Quantum Cryptography I,,Springer LNCS 6745 (proceedings paper appears as 'Security of Device-Independent QKD Protocols' by Dhara/Masanes/Pironio/Acín); source_type=claude_extraction,2011-05-24,12:00,30
TQC,2011,regular,Self-Testing Graph States,Matthew McKague,Matthew McKague,"Centre for Quantum Technologies, National University of Singapore","Self-testing was introduced by Mayers and Yao. The goal of self-testing is to verify the operation of a group of non-communicating quantum devices using only classical interaction with the devices and without trusting any of them a priori. In this article we describe two different self-tests which verify that a group of devices share a graph state and implement Pauli X and Z measurements on this state. The self-tests can be reinterpreted as Bell inequalities which have a unique strategy that achieves the quantum bound.",,,,,Quantum Algorithms I,,Springer LNCS 6745; source_type=claude_extraction,2011-05-25,12:00,30
TQC,2011,regular,Multi-query Quantum Sums,David A. Meyer,David A. Meyer; James Pommersheim,"Department of Mathematics, UCSD; Department of Mathematics, Reed College","PARITY is the oracle (or black-box) problem of determining the parity of an n-bit string by querying positions in the string. We construct an n-r quantum query algorithm that computes the sum correctly with probability min{floor(n/r)/k,1}, for each 1 <= r <= n. This quantum algorithm utilizes the n-r queries sequentially and adaptively, like quantum search algorithms, but in a different way that is not amplitude amplification. We motivate the development of our algorithm by considering the simplest new instances of SUM and conclude by recalling the result of van Dam.",,,,,Quantum Algorithms II,,Springer LNCS 6745; source_type=claude_extraction,2011-05-26,10:30,30
TQC,2011,regular,Which Graph States Are Useful for Quantum Information Processing?,Mehdi Mhalla,Mehdi Mhalla; Mio Murao; Simon Perdrix; Masato Someya; Peter S. Turner,"CNRS, LIG, Université de Grenoble; Graduate School of Science, The University of Tokyo; NanoQuine, The University of Tokyo","The graph state formalism is an elegant and powerful formalism for quantum information processing. We focus on the application of graph states in MBQC and in particular on the characterisation of graphs that can be used to perform quantum information processing in this context. We introduce a simpler but equivalent combinatorial characterisation using focused gflow and we provide a simple condition of existence of such a flow as the existence of a right inverse to the adjacency matrix of the graph. The main contribution of this work is the weakening of the determinism condition in order to consider the more general class of information preserving evolutions.",,,,,Quantum Algorithms II,,Springer LNCS 6745; source_type=claude_extraction,2011-05-26,12:00,30
TQC,2011,regular,Span-Program-Based Quantum Algorithm for Evaluating Unbalanced Formulas,Ben W. Reichardt,Ben W. Reichardt,"Institute for Quantum Computing, University of Waterloo","The formula-evaluation problem is defined recursively. We give a quantum algorithm to evaluate formulas over any finite boolean gate set. Provided that the general adversary bound complexities of the input subformulas to any gate differ by at most a constant factor, the algorithm has optimal query complexity. Importantly, after efficient preprocessing, the algorithm is nearly time optimal. The algorithm is derived using the framework relating span programs and quantum algorithms. It corresponds to the composition of the individual span programs for each gate in the formula. We define a new span program complexity measure, the full witness size, allowing quantum algorithms to be based on span programs with free inputs.",,,,,Quantum Algorithms I,,Springer LNCS 6745; source_type=claude_extraction,2011-05-25,11:30,30
TQC,2011,regular,Mistrustful Quantum Cryptography in a Device-Independent Setting,Jonathan Silman,Jonathan Silman; André Chailloux; Nati Aharon; Iordanis Kerenidis; Stefano Pironio; Serge Massar,"Laboratoire d'Information Quantique, Université Libre de Bruxelles; LIAFA, Univ. Paris 7 and Univ. Paris-Sud; School of Physics and Astronomy, Tel-Aviv University; LIAFA, Univ. Paris 7 - CNRS and Centre for Quantum Technologies, National University of Singapore","Device-independent cryptographic protocols are by definition more secure than their device-dependent counterparts, since they do not rely on any assumptions regarding the internal workings of the apparatus used to implement them. Thus far, the device-independent approach has been successfully applied to problems such as quantum-key distribution and randomness generation, but it is not a priori clear whether it can be applied to protocols in the mistrustful cryptography class, where the parties do not trust one another. In this work we show that for bit-commitment and coin flipping a device-independent treatment is possible.",,,,,Quantum Cryptography I,,Springer LNCS 6745 (proceedings paper appears as 'Weak Coin Flipping in a Device-Independent Setting' by Aharon/Chailloux/Kerenidis/Massar/Pironio/Silman); source_type=claude_extraction,2011-05-24,10:30,30
TQC,2011,regular,Tight Finite-Key Analysis for Quantum Cryptography,Marco Tomamichel,Marco Tomamichel; Charles Ci Wen Lim; Renato Renner; Nicolas Gisin,"Institute for Theoretical Physics, ETH Zurich; Group of Applied Physics, University of Geneva","Quantum Key Distribution (QKD), invented by Bennett and Brassard and Ekert can be considered the first application of quantum information science. We focus on the assumption that an arbitrarily large number M of signals can be exchanged between the legitimate parties (Alice and Bob) and subsequently used for the computation of the final key. Here, we apply a novel proof technique to the BB84 QKD protocol and derive almost tight bounds on the minimum value M required to achieve a given level of security. The technique is based on a formulation of the uncertainty relation in terms of smooth entropies. We demonstrate significant improvements of the finite-key rate over existing results.",1103.4130,,,,Quantum Cryptography I,,Talk in proceedings book of abstracts but not in Springer LNCS 6745; talk title in program: Towards a tight finite key analysis for BB84; source_type=claude_extraction,2011-05-24,11:30,30
TQC,2011,regular,Bitwise Quantum Min-Entropy Sampling and New Lower Bounds for Random Access Codes,Jürg Wullschleger,Jürg Wullschleger,"DIRO, Université de Montréal; McGill University","Extracting uniform randomness from a long string x of length n using a two-universal hash function or an extractor may be very inefficient. We show that the bounds given in König-Renner also apply to the case where the sample is chosen bitwise uniformly, instead of (recursively) in blocks. We also prove a new min-entropy sampling theorem using a completely different approach. As corollary we obtain a lower bound for random access codes: for any k-out-of-n random access code where the storage is bounded by m <= (1-epsilon)n, the success probability is at most 2^{-Omega(k)}.",,,,,Quantum Algorithms II,,Springer LNCS 6745; source_type=claude_extraction,2011-05-26,11:30,30
