venue,year,paper_type,title,speakers,authors,affiliations,abstract,arxiv_ids,presentation_url,video_url,youtube_id,session_name,award,notes,scheduled_date,scheduled_time,duration_minutes
QCRYPT,2025,regular,A robust and composable device-independent protocol for oblivious transfer using (fully) untrusted quantum devices in the bounded storage model,,Rishabh Batra;Sayantan Chakraborty;Rahul Jain;Upendra Kapshikar,"CQT, NUS;University of Montreal;CQT, NUS;University of Ottawa","We present a robust and composable device-independent (DI) quantum protocol between
two parties for oblivious transfer (OT) using Magic Square devices in the bounded storage
model [DFR`07, DFSS08] in which the (honest and cheating) devices and parties have no long-
term quantum memory. After a fixed constant (real-world) time interval, referred to as DELAY,
the quantum states decohere completely. The adversary (cheating party), with full control over
the devices, is allowed joint (non-IID) quantum operations on the devices, and there are no time
and space complexity bounds placed on its powers. The running time of the honest parties is
polylog(λ) (where λ is the security parameter). Our protocol has negligible (in λ) correctness
and security errors and can be implemented in the NISQ (Noisy Intermediate Scale Quantum)
era. By robustness, we mean that our protocol is correct even when devices are slightly off
(by a small constant) from their ideal specification. This is an important property since small
manufacturing errors in the real-world devices are inevitable. Our protocol is sequentially
composable and, hence, can be used as a building block to construct larger protocols (including
DI bit-commitment and DI secure multi-party computation) while still preserving correctness
and security guarantees.
None of the known DI protocols for OT in the literature are robust and secure against joint
quantum attacks. This was a major open question in device-independent two-party distrustful
cryptography, which we resolve.
We prove a parallel repetition theorem for a certain class of entangled games with a hybrid
(quantum-classical) strategy to show the security of our protocol. The hybrid strategy helps to
incorporate DELAY in our protocol. This parallel repetition theorem is a main technical contribution of our work. Since our games use hybrid strategies and the inputs to our games are not independent, we use a novel combination of ideas from previous works showing parallel rep-
etition of classical games [Raz95, Hol07], quantum games [JPY14, JMS20, JK22], and anchored
games [BVY17, JK21].
Although we present security proof for protocols in the bounded storage model with no
long-term quantum memory (after DELAY), we state (without further justification) that we
can extend our results, along the lines of [JK22] and [DFR`07], to incorporate linear (in the
number of devices) long term quantum memory and linear leakage between the devices.",,,https://www.youtube.com/watch?v=d3ahJusi4rc,d3ahJusi4rc,Contributed Talk 5b,,source_type=claude_extraction; session_chair=Yang Liu,2025-08-29,11:00,
