venue,year,paper_type,title,speakers,authors,affiliations,abstract,arxiv_ids,presentation_url,video_url,youtube_id,session_name,award,notes,scheduled_date,scheduled_time,duration_minutes
QCRYPT,2025,invited,Long-range quantum correlations and DIQKD in routed Bell scenarios,Jef Pauwels,,University of Geneva,"Transmission loss remains a major obstacle for long-distance demonstrations of nonlocality and device-independent applications. In this talk, I will discuss routed Bell experiments, in which a particle sent to one party in a Bell experiment can be measured either near or far from the source, as a promising approach to overcoming this challenge. I will explain how to characterize correlations in routed setups, how to compute device-independent key rates, and present a routed Bell inequality that can be violated by qubit entanglement with arbitrary loss.",,,https://www.youtube.com/watch?v=biOJmCaeucA,biOJmCaeucA,Invited Talk,,source_type=claude_extraction; session_chair=Gláucia Murta,2025-08-27,11:10,
QCRYPT,2025,regular,Simpler and Tighter Device-Independent Security Proofs,,Thomas Hahn;Amir Arqand;Ernest Tan;Peter Brown,Weizmann Institute of Science;University of Waterloo;University of Waterloo;Télécom Paris,"Variational techniques have been recently developed to find tighter bounds on the von Neumann entropy in a completely device-independent (DI) setting. This, in turn, has led to significantly improved key rates of DI protocols, in both the asymptotic limit as well as in the finite-size regime. In this work, we derive novel variational expressions for Petz-Rényi divergences instead. We also derive two critical applications of this result. First, we show how these variational expressions can be used to further improve the finite-size key rate of DI protocols, by developing a fully-Rényi entropy accumulation theorem that can utilize these expressions for key rate computations. Second, we derive a security condition for DI advantage distillation that is based on the pretty good fidelity. We implement these techniques to derive increased noise tolerances for DIQKD protocols, which surpass the previously known bounds.",,,https://www.youtube.com/watch?v=EFJqK5uMHHw,EFJqK5uMHHw,Contributed Talk 3b (original 3a),,source_type=claude_extraction; session_chair=Gláucia Murta,2025-08-27,11:55,
QCRYPT,2025,regular,Computational quantum unpredictability entropy and quantum leakage resilience,,Noam Avidan;Rotem Arnon,Weizmann Institute of Science;Weizmann Institute of Science,"Computational entropy notions play a central role in classical cryptography, with well-developed frameworks for analyzing unpredictability, leakage resilience, and pseudo-randomness. In the quantum setting, however, computational analogues of entropy remain largely unexplored. While quantum information theory provides powerful tools based on information-theoretic entropy, these do not capture the limitations of computationally bounded quantum adversaries.
    In this work, we initiate the study of quantum computational entropy by defining \emph{quantum computational unpredictability entropy}, a natural generalization of classical unpredictability entropy to the quantum setting. Our definition is based on the operational meaning of quantum min-entropy, but restricts the adversary to efficient quantum guessing strategies.
    We prove that this entropy satisfies several important properties, including a leakage chain rule that holds even in the presence of prior quantum side-information. We also show that unpredictability entropy supports pseudo-randomness extraction against quantum adversaries with bounded computational power.  Together, these results lay a foundation for developing cryptographic tools that rely on min-entropy in the quantum computational setting.",,,https://www.youtube.com/watch?v=7yHs6pXQ7JM,7yHs6pXQ7JM,Contributed Talk 3b (original 3a),,source_type=claude_extraction; session_chair=Gláucia Murta,2025-08-27,11:55,
QCRYPT,2025,tutorial,Advances in Quantum Random Number Generation,Giuseppe Vallone,,University of Padova,"Quantum Random Number Generators (QRNGs) exploit intrinsic probabilistic quantum processes to generate true random numbers. This tutorial reviews the experimental methods and theoretical tools necessary for generating and certifying random numbers using quantum systems. We explore various QRNG implementations, discuss their advantages and limitations, and examine the protocols used to verify the randomness and security of the generated numbers.",,,https://www.youtube.com/watch?v=MTYwfLCgfjQ,MTYwfLCgfjQ,Tutorial Talk,,source_type=claude_extraction; session_chair=Davide Rusca,2025-08-27,14:00,
QCRYPT,2025,invited,Microsatellite-based quantum key distribution and beyond,Yang Li,,University of Science and Technology of China,"Quantum key distribution (QKD) enables secure communication guaranteed by the fundamental laws of physics. While the Micius satellite has verified the feasibility of satellite-based QKD, deploying large-scale quantum constellations remains a challenge, requiring miniaturized satellites, portable ground stations, and real-time key exchange. To this end, I will present the development and launch of a quantum microsatellite and the subsequent demonstration of real-time satellite-ground QKD with multiple small-aperture, portable ground stations. During a single satellite pass, we generated a secure key of up to 1.07 million bits. Also, a secret key, enabling one-time pad encryption of images, is created between China and South Africa at locations separated by over 12,900 kilometers on Earth. This achievement represents a critical step toward a practical global quantum network. I will also present our ongoing progress in demonstrating daylight QKD, as well as the developments of a low-Earth-orbit satellite constellation prototype and a high-Earth-orbit quantum satellite.",,,https://www.youtube.com/watch?v=9mjmOo-vjB8,9mjmOo-vjB8,Invited Talk,,source_type=claude_extraction; session_chair=Feihu Xu,2025-08-27,15:45,
QCRYPT,2025,invited,Surpassing the loss-noise robustness trade-off in QKD,Hannah Seabrook,,University of Bristol,"Quantum key distribution (QKD) offers a theoretically secure method to share secret keys, yet practical implementations face challenges due to noise and loss over long-distance channels. Traditional QKD protocols require extensive noise compensation, hindering their industrial scalability and lowering the achievable key rates. Alternative protocols encode logical qubits in noise-resilient states, but at the cost of using many physical qubits, increasing susceptibility to loss and limiting transmission distance. In this talk, I will introduce a logical qubit encoding that uses antisymmetric Bell-states in the continuous photonic degrees of freedom, frequency and time. By leveraging the continuous space, I will show how we overcome this noise-loss robustness trade-off by minimising the number of photons per logical qubit, whilst optimising the encoding resilience over noise fluctuations. I will analyse the security of our encoding and demonstrate its robustness compared to existing state-of-the-art protocols. This approach provides a path towards scalable, efficient QKD implementations under realistic noise conditions.",,,https://www.youtube.com/watch?v=OVoEBmrReT4,OVoEBmrReT4,Invited Talk,,source_type=claude_extraction; session_chair=Feihu Xu,2025-08-27,16:30,
QCRYPT,2025,regular,Experimental mode-pairing quantum key distribution surpassing the repeaterless bound,,Likang Zhang;Wei Li;Jiawei Pan;Yichen Lu;Wenwen Li;Zheng-Ping Li;Yizhi Huang;Xiongfeng Ma;Feihu Xu;Jianwei Pan,University of Science and Technology of China;University of Science and Technology of China;University of Science and Technology of China;University of Science and Technology of China;University of Science and Technology of China;University of Science and Technology of China;Tsinghua University;Tsinghua University;University of Science and Technology of China;University of Science and Technology of China,"We demonstrate a practical high-performance mode-pairing quantum key distribution system that is able to surpass the repeaterless key rate bound using commercial lasers. We propose a frequency tracking scheme to address phase fluctuations and a theoretical model to analyze the phase noise and optimize the system parameters. Our system achieves a secret key rate of 47.8 bit/s over 403 km standard fiber, which is 2.92 times of the repeaterless bound. Furthermore, we compare the performance between MP-QKD and no-phase-locking TF-QKD under various practical conditions and show that MP-QKD exhibits superior performance at short distances with low error rates, while TF-QKD is more advantageous for long distances with consistent error rates.",,,https://www.youtube.com/watch?v=5mdyYuor0Do,5mdyYuor0Do,Contributed Talk 3c (original 1a),,source_type=claude_extraction; session_chair=Feihu Xu,2025-08-27,17:15,
QCRYPT,2025,regular,Chip-Based 16 GBaud Continuous-Variable Quantum Key Distribution,,Adnan Hajomer;Ivan Derkach;Ulrik L. Andersen;Axl Bomhals;C´edric Bruynsteen;Aboobackkar Sidhique;Xin Yin;Tobias Gehring†,Technical University of Denmark;Technical University of Denmark;Technical University of Denmark;Ghent University-imec;Ghent University-imec;Ghent University-imec;Ghent University-imec;Technical University of Denmark,"Quantum key distribution (QKD) stands as the most successful application of quantum information
science, providing information-theoretic security for key exchange. While it has evolved from
proof-of-concept experiments to commercial products, widespread adoption requires chip-based integration to reduce costs, enable mass production, facilitate miniaturization, and enhance system
performance. Here, we demonstrate the first fully photonic-integrated continuous-variable QKD
(CVQKD) system operating at a classical telecom symbol rate of 16 GBaud. Our system integrates
a silicon photonic transmitter circuit (excluding the laser source) and a 20 GHz photonic-electronic
receiver, which features a phase-diverse silicon photonic integrated circuit and custom-designed
GaAs pHEMT transimpedance amplifiers. Advanced digital signal processing allows our system to
achieve the highest reported secure key rate to date, reaching 0.289 Gb/s and 0.246 Gb/s over a
20 km fiber link in the asymptotic and finite-size regimes, respectively. These results establish a
record key rate and represent a critical step toward scalable, cost-effective, and mass-deployable
quantum-secure communication using photonic-integrated CVQKD systems.",,,https://www.youtube.com/watch?v=b9m_WTFrXXg,b9m_WTFrXXg,Contributed Talk 3c (original 1a),,source_type=claude_extraction; session_chair=Feihu Xu,2025-08-27,17:15,
QCRYPT,2025,tutorial,Quantum position verification: where are we now?,Florian Speelman,,University of Amsterdam,"Location can be strongly correlated to trust and identity: For example, when visiting a bank, you might trust the teller just by virtue of her position behind the counter. We would like to be able to use position as a cryptographic credential, being able to encrypt messages that can only be read at a certain location, or signing messages so that we are sure that they are sent from a promised spot.

In this tutorial, we will study the task of quantum position verification (QPV) - where an untrusted party uses quantum information to prove their location, which enables more advanced tasks such as encrypting messages to be only read at a certain location. This is impossible to achieve if all communication and computation is classical, even under computational assumptions, and is an exciting possible use of quantum communication.

In the session, we will start with an overview of basic protocols, inspired by BB84 quantum key distribution, and their security proofs. We will then go over some experimental obstacles on implementing such protocols in practice, and how to modify the protocols to overcome them. On the theoretical side, the QPV task turns out to be connected to the AdS/CFT correspondence, and to various topics in quantum communication and cryptography, because attacks require a form of non-local quantum computation (NLQC). We will go over these connections, and survey open questions on this topic.",,,https://www.youtube.com/watch?v=EzEmNInUACU,EzEmNInUACU,Tutorial Talk,,source_type=claude_extraction; session_chair=Ian George,2025-08-28,08:40,
QCRYPT,2025,invited,Anonymous communication in quantum networks,Gláucia Murta,,Technische Universität Wien,"Secure communication is a core task in cryptography which is focused on protecting the content of a message against eavesdroppers. In certain scenarios, however, the identities of the communicating parties are themselves sensitive and must remain concealed. This calls for anonymous communication protocols that ensure not only message secrecy but also the privacy of participants' identities. In this talk, I will present recent advances showing how quantum systems can offer advantages for anonymous communication in network settings. I will introduce a security framework that encompasses the secrecy of a shared key and the anonymity of the communicating users and show how the correlations of multipartite Greenberger-Horne-Zeilinger (GHZ) states enable protocols that outperform those based on bipartite entanglement. I will also highlight a recent experimental realization that demonstrates that these advantages are already accessible with current technology. Finally, I will outline open questions and possible directions for future research in this emerging area.",,,https://www.youtube.com/watch?v=wZqprfTs_nM,wZqprfTs_nM,Invited Talk,,source_type=claude_extraction; session_chair=Ian George,2025-08-28,09:55,
QCRYPT,2025,invited,"A General Quantum Duality for Representations of Groups with Applications to Quantum Money, Lightning, and Fire",Barak Nehoran,,Princeton University,"Aaronson, Atia, and Susskind (2020) established that efficiently mapping between quantum states |ψ⟩ and |φ⟩ is computationally equivalent to distinguishing their superpositions 1/√2(|ψ⟩ + |φ⟩) and 1/√2(|ψ⟩ − |φ⟩). We generalize this insight into a broader duality principle in quantum computation, wherein manipulating quantum states in one basis is equivalent to extracting their value in a complementary basis. In its most general form, this duality principle states that for a given group, the ability to implement a unitary representation of the group is computationally equivalent to the ability to perform a Fourier extraction from the invariant subspaces corresponding to its irreducible representations.

Building on our duality principle, we present the following applications: (1) Quantum money, which captures quantum states that are verifiable but unclonable, and its stronger variant, quantum lightning, have long resisted constructions based on concrete cryptographic assumptions. While (public-key) quantum money has been constructed from indistinguishability obfuscation (iO)—an assumption widely considered too strong—quantum lightning has not been constructed from any such assumptions, with previous attempts based on assumptions that were later broken. We present the first construction of quantum lightning with a rigorous security proof, grounded in a plausible and well-founded cryptographic assumption. We extend the construction of Zhandry (2024) from Abelian group actions to non-Abelian group actions, and eliminate Zhandry’s reliance on a black-box model for justifying security. Instead, we prove a direct reduction to a computational assumption – the pre-action security of cryptographic group actions. We show how these group actions can be realized with various instantiations, including with the group actions of the symmetric group implicit in the McEliece cryptosystem. (2) We provide an alternative quantum money and lightning construction from one-way homomorphisms, showing that security holds under specific conditions on the homomorphism. Notably, our scheme exhibits the remarkable property that four distinct security notions—quantum lightning security, security against both worst-case cloning and average-case cloning, and security against preparing a specific canonical state – are all equivalent. (3) Quantum fire captures the notion of a samplable distribution on quantum states that are efficiently clonable, but not efficiently telegraphable, meaning they cannot be efficiently encoded as classical information. These states can be spread like fire, provided they are kept alive quantumly and do not decohere. The only previously known construction relied on a unitary quantum oracle, whereas we present the first candidate construction of quantum fire using a classical oracle.

Based on joint work with John Bostanci and Mark Zhandry.",,,https://www.youtube.com/watch?v=dNzOyUlGKpA,dNzOyUlGKpA,Invited Talk,,source_type=claude_extraction; session_chair=Kirill Fedorov,2025-08-28,11:10,
QCRYPT,2025,regular,Experimental Private Quantum Sensing,,Nicolas Laurent-Puig;Laura dos Santos Martins;Luis Bugalho;Santiago Scheiner;Majid Hassani;Sean Moore;Damian Markham;Eleni Diamanti,"Sorbonne Université, CNRS, LIP6;Sorbonne Université, CNRS, LIP6;Instituto Superior Técnico, Universidade de Lisboa, Portugal;Sorbonne Université, CNRS, LIP6;Instituut-Lorentz, Universiteit Leiden, P.O. Box 9506, 2300 RA Leiden, The Netherlands;Sorbonne Université, CNRS, LIP6;Sorbonne Université, CNRS, LIP6;Sorbonne Université, CNRS, LIP6","Quantum sensors are powerful tools for measuring physical quantities with high sensitivity, enabling, for instance, the mapping of Earth’s gravitational field , detecting very small changes of magnetic fields, or the passage of time. The underlying principle is to use a quantum state as a probe that interacts with the physical quantity of interest, thereby encoding relevant information into the state. Although individual quantum sensors may exhibit remarkable sensitivity, the precision of a certain measurement can be significantly enhanced when multiple probes are entangled. Distributed quantum sensing extends this further and leverages entanglement among spatially separated sensors, allowing them to function as
a single, coherent system. This approach enables measurements across extended spatial regions, while surpassing the precision achievable by independent sensors. However, a significant challenge in a network setting is ensuring that sensors deployed across different parties serve as the necessary resources for the correct functioning of the target sensing task. This challenge has motivated the combination of quantum cryptography with quantum sensing. In this context, Shettell et al. introduced the notion of privacy for sensor networks, ensuring that, beyond the metrological advantage of cooperative estimation of a global function, parties can also maintain the privacy of their local information and control what data is accessible to others. In this work, we adopt this protocol and focus on a multi-user quantum
sensor network framework to analyze the privacy aspects of this parameter estimation task, leveraging a high-quality four-party GHZ state source.",,,https://www.youtube.com/watch?v=KWt0n3g6xlU,KWt0n3g6xlU,Contributed Talk 4a,,source_type=claude_extraction; session_chair=Kirill Fedorov,2025-08-28,11:55,
QCRYPT,2025,regular,Renyi security framework against coherent attacks applied to decoy-state QKD,,Lars Kamin;John Burniston;Ernest Y.-Z. Tan,"Institute for Quantum Computing and Department of Physics and Astronomy, University of Waterloo;Institute for Quantum Computing and Department of Physics and Astronomy, University of Waterloo;Institute for Quantum Computing and Department of Physics and Astronomy, University of Waterloo","We develop a flexible and robust framework for finite-size security proofs of quantum key distribution (QKD) protocols under coherent attacks, applicable to both fixed- and variable-length protocols. Our methods achieve high finite-size key rates across a broad class of protocols while imposing minimal requirements. In particular, it eliminates the need for restrictive assumptions such as limited repetition rates or the implementation of virtual tomography procedures. To achieve this goal, we introduce new numerical techniques for the evaluation of conditional sandwiched Renyi entropies, enabling tight key rate bounds without compromising generality. In doing so, we find an alternative formulation of the ``QKD cone'' studied in previous work, which may be of independent interest. Moreover, we illustrate the versatility of our framework by applying it to several practically relevant protocols, including decoy-state protocols. Furthermore, we extend the analysis to accommodate realistic device imperfections, such as independent intensity and phase imperfections. Overall, our framework provides both greater scope of applicability and better key rates than existing techniques, especially for small block sizes, offering a scalable path toward secure quantum communication under realistic conditions.",,,https://www.youtube.com/watch?v=pv1XlEsbmTg,pv1XlEsbmTg,Contributed Talk 4a,,source_type=claude_extraction; session_chair=Kirill Fedorov,2025-08-28,11:55,
QCRYPT,2025,regular,Public-Key Quantum Fire From Classical Oracles,,Alper Cakan;Vipul Goyal;Omri Shmueli,Carnegie Mellon University;NTT Research;NTT Research,"Recent work of Bostanci, Nehoran, Zhandry (STOC'25, QIP'25) formalized the notion of quantum fire: A quantum state that can be cloned efficiently but cannot be converted to a classical string. Nehoran and Zhandry (QIP'23) gave a construction of quantum fire relative to an (inefficient) unitary quantum oracle, and proved its correctness and security. Bostanci et al (STOC'25, QIP'25)  gave a candidate construction of quantum fire based on cryptographic group action assumptions, and proved its correctness. However, they do not have a proof of security, and the security is only conjectured without any justification at all.  In this work, we give the first construction of (public-key) quantum fire relative to a classical oracle, and prove its correctness and security.  This resolves the open question posed by  Bostanci et al (STOC'25, QIP'25) and Nehoran and Zhandry (QIP'23). Further, assuming existence of one-way functions, our scheme can also be made efficient. We note that, even in the unitary quantum oracle setting, no efficient quantum fire scheme existed: Nehoran-Zhandry show that their unitary oracle cannot be made efficient.

Implications to Physics: In quantum mechanics, various fundamental principles called no-go properties exist, such as no-cloning theorem, no-hiding theorem, no-deleting theorem, no-telegraphing theorem and so on. Most of these no-go properties have been shown to be equivalent to each other. However, our result gives the first (classical oracle) separation between no-go properties of quantum mechanics! Our result means that, relative to a classical oracle, no-telegraphing does not imply no-cloning. Note that, in the information-theoretic setting, no-cloning and no-telegraphing are equivalent. Our result means that the equivalency of the fundamental no-go principles of quantum mechanics that we take for granted might not hold in a computational world!",,,https://www.youtube.com/watch?v=YrvEx2u1ug0,YrvEx2u1ug0,Contributed Talk 4b,,source_type=claude_extraction; session_chair=Devashish Tupkary,2025-08-28,14:45,
QCRYPT,2025,regular,Self-testing tilted strategies for maximal loophole-free nonlocality,,Nicolas Gigena;Ekta Panwar;Giovanni Scala;Mateus Araújo;Máté Farkas;Anubhav Chaturvedi,Universidad Nacional de La Plata;University of Gdansk;Politecnico di Bari;Universidad de Valladolid;University of York;University of Gdansk,"The degree of experimentally attainable nonlocality, as gauged by the loophole-free or effective violation of Bell inequalities, remains severely limited due to inefficient detectors. We address an experimentally motivated question: Which quantum strategies attain the maximal loophole-free nonlocality in the presence of inefficient detectors? For any Bell inequality and any specification of detection efficiencies, the optimal strategies are those that maximally violate a tilted version of the Bell inequality in ideal conditions. In the simplest scenario, we demonstrate that the quantum strategies that maximally violate the doubly-tilted versions of Clauser-Horne-Shimony-Holt inequality are unique up to local isometries. We utilize Jordan's lemma and Grobner basis-based proof technique to analytically derive self-testing statements for the entire family of doubly-tilted CHSH inequalities and numerically demonstrate their robustness. These results enable us to reveal the insufficiency of even high levels of the Navascues-Pironio-Acin hierarchy to saturate the maximum quantum violation of these inequalities.",,,https://www.youtube.com/watch?v=WzqWm3uEhZY,WzqWm3uEhZY,Contributed Talk 4b,,source_type=claude_extraction; session_chair=Devashish Tupkary,2025-08-28,14:45,
