venue,year,paper_type,title,speakers,authors,affiliations,abstract,arxiv_ids,presentation_url,video_url,youtube_id,session_name,award,notes,speaker,scheduled_date,scheduled_time,duration_minutes
QIP,2026,merged_contributed,Optimal lower bounds for quantum state tomography,,Thilo Scharnhorst;Jack Spilecki;John Wright,UC Berkeley;UC Berkeley;UC Berkeley,"We show that $n = \Omega(rd/\epsilon^2)$ copies are necessary to learn a rank $r$ mixed state $\rho \in \C^{d \times d}$ up to error~$\epsilon$ in trace distance. This matches the upper bound of $n = O(rd/\epsilon^2)$ from~\cite{OW16} and therefore settles the sample complexity of mixed state tomography. We prove this lower bound by studying a special case of full state tomography that we refer to as \emph{projector tomography}, in which $\rho$ is promised to be of the form $\rho = P/r$, where $P \in \C^{d \times d}$ is a rank $r$ projector. A key technical ingredient in our proof, which may be of independent interest, is a reduction which converts any algorithm for projector tomography which learns to error $\epsilon$ in trace distance to an algorithm which learns to error $O(\epsilon)$ in the more stringent Bures distance.",,,,,,,AcceptedAsMerge,,,,
QIP,2026,contributed,Fast-forwardable Lindbladians imply quantum phase estimation,,Zhong-Xia Shang;Naixu Guo;Patrick Rebentrost;Al´an Aspuru-Guzik;Tongyang Li;Qi Zhao,University of Hong Kong;National University of Singapore;National University of Singapore;University of Toronto;Peking University;University of Hong Kong,"Quantum phase estimation (QPE) and Lindbladian dynamics are both foundational in quantum information science and central to quantum algorithm design. In this work, we bridge these two concepts: certain simple Lindbladian processes can be adapted to perform QPE-type tasks. However, unlike QPE, which achieves Heisenberg-limit scaling, these Lindbladian evolutions are restricted to standard quantum limit complexity. This indicates that, different from Hamiltonian dynamics, the natural dissipative evolution speed of such Lindbladians does not saturate the fundamental quantum limit, thereby suggesting the potential for quadratic fast-forwarding. We confirm this by presenting a quantum algorithm that simulates these Lindbladians for time $t$ within an error $\varepsilon$ using $\mathcal{O}\left(\sqrt{t\log(\varepsilon^{-1})}\right)$ cost. This, to our knowledge, is the first example of Lindbladian fast forwarding, which shares a fundamentally different mechanism from the fast-forwarding examples of Hamiltonian dynamics. As a bonus, this fast-forwarded simulation naturally serves as a new Heisenberg-limit QPE algorithm. Therefore, our work explicitly bridges the standard quantum limit-Heisenberg limit transition to the fast-forwarding of dissipative dynamics. We also adopt our fast-forwarding algorithm for efficient Gibbs state preparation and demonstrate the counter-intuitive implication: the allowance of a quadratically accelerated decoherence effect under arbitrary Pauli noise.",,,,,,,Accepted,Zhong-Xia Shang,30 January,15:30,30
QIP,2026,plenary_short,Compressed Permutation Oracles,,Joseph Carolan,University of Maryland,"The analysis of quantum algorithms which query random, invertible permutations has been a long-standing challenge in cryptography. Many techniques which apply to random oracles fail, or are not known to generalize to this setting. As a result, foundational cryptographic constructions involving permutations often lack quantum security proofs. With the aim of closing this gap, we develop and prove soundness of a compressed permutation oracle. Our construction shares many of the attractive features of Zhandry's original compressed function oracle: the purification is a small list of input-output pairs which meaningfully reflect an algorithm's knowledge of the oracle.

We then apply this framework to show that the seven-round balanced Feistel construction is a strong quantum PRP, resolving an open question of (Zhandry, 2012). We further re-prove essentially all known quantum query lower bounds in the random permutation model, notably the collision and preimage resistance of both Sponge and Davies-Meyer, hardness of double-sided zero search and sparse predicate search, and give new lower bounds for cycle finding and the one-more problem.",,,,,,,AcceptedAsPlenary,Joseph Carolan,27 January,11:00,30
QIP,2026,contributed,Polynomial-time tolerant testing stabilizer states,,Srinivasan Arunachalam;Arkopal Dutt,IBM Quantum;IBM Quantum,"We consider the following task: suppose an algorithm is given copies of an unknown $n$-qubit quantum state $\ket{\psi}$ promised $(i)$ $\ket{\psi}$ is $\varepsilon_1$-close to a stabilizer state in fidelity or $(ii)$ $\ket{\psi}$ is  $\varepsilon_2$-far from all stabilizer states, decide which is the case. We show that for every $\varepsilon_1>0$ and $\varepsilon_2\leq \varepsilon_1^C$, there is a $\poly(1/\varepsilon_1)$-sample and $n\cdot \poly(1/\varepsilon_1)$-time algorithm that decides which is the case (where $C>1$ is a universal constant). Our proof includes a new definition of Gowers norm for quantum states, an inverse theorem for the Gowers-$3$ norm of quantum states and new bounds on stabilizer covering for structured subsets of Paulis using results in additive~combinatorics.",2408.06289,,,,,,Accepted,Srinivasan Arunachalam,30 January,11:00,30
QIP,2026,contributed,Approximate Quantum Error Correction with 1D Log-Depth Circuits,,Guoding Liu;Zhenyu Du;Zi-Wen Liu;Xiongfeng Ma,Tsinghua University;Tsinghua University;Tsinghua University;Tsinghua University,"Efficient and high-performance quantum error correction is essential for achieving fault-tolerant quantum computing. Low-depth random circuits offer a promising approach to identifying effective and practical encoding strategies. In this work, we rigorously prove through information-theoretic analysis that one-dimensional logarithmic-depth random Clifford encoding circuits can achieve high quantum error correction performance. We demonstrate that these random codes typically exhibit good approximate quantum error correction capability by proving that their encoding rate achieves the hashing bound for Pauli noise and the channel capacity for erasure errors. We show that the error correction inaccuracy decays once a threshold of logarithmic depth is exceeded, resulting in negligible recovery errors. This threshold is shown to be lower than that of the simple separate block encoding, and the decay rate is higher. We further establish that these codes are optimal by proving that logarithmic depth is necessary to maintain a constant encoding rate and high error correction performance. To prove our results, we propose new decoupling theorems for one-dimensional low-depth circuits. These results also imply strong decoupling and rapid thermalization properties in low-depth random circuits and have potential applications in quantum information science and physics.",2503.17759,,,,,,Accepted,Guoding Liu,30 January,10:00,30
QIP,2026,contributed,Layer codes as partially self-correcting quantum memories,,Shouzhen Gu;Libor Caha;Shin Ho Choe;Zhiyang He;Aleksander Kubica;Eugene Tang,Yale University;Technical University of Munich;IQM Quantum Computers;Massachusetts Institute of Technology;Yale University;Northeastern University,"We investigate layer codes, a family of three-dimensional stabilizer codes that can achieve optimal scaling of code parameters and a polynomial energy barrier, as candidates for self-correcting quantum memories. First, we introduce two decoding algorithms for layer codes with provable guarantees for local stochastic and adversarial noise, respectively. We then prove that layer codes are partially self-correcting quantum memories. With memory times scaling exponentially in the linear size of the system, layer codes outperform the previously demonstrated subexponential scaling of the welded solid code. Notably, we argue that partial self-correction without the requirement of efficient decoding is more common than expected, as it arises from a diverging energy barrier. This draws a sharp distinction between partially self-correcting systems, and partially self-correcting memories. Another novel aspect of our work is an analysis of layer codes constructed from random Calderbank–Shor–Steane codes. We show that these random layer codes have optimal scaling (up to logarithmic corrections) of code parameters and a polynomial energy barrier. Finally, we present numerical studies of their memory times and report behavior consistent with partial self-correction.",,,,,,,Accepted,Shouzhen Gu,27 January,15:30,30
QIP,2026,contributed,Inverse Nonlinear Fast Fourier Transform: Closing A Chapter in Quantum Signal Processing,,Hongkang Ni;Rahul Sarkar;Lexing Ying;Lin Lin,"Stanford University;University of California, Berkeley;Stanford University;University of California, Berkeley","The nonlinear Fourier transform (NLFT) extends the classical Fourier transform by replacing addition with matrix multiplication. While the NLFT on $\mathrm{SU}(1,1)$ has been widely studied, its $\mathrm{SU}(2)$ variant has only recently attracted attention due to emerging applications in quantum signal processing (QSP) and quantum singular value transformation (QSVT). In this paper, we investigate the inverse NLFT on $\mathrm{SU}(2)$ and establish the numerical stability of the layer stripping algorithm for the first time under suitable conditions. Furthermore, we develop a fast and numerically stable algorithm, called inverse nonlinear fast Fourier transform, for performing inverse NLFT with near-linear complexity. This algorithm is applicable to computing phase factors for both QSP and the generalized QSP (GQSP).",2505.12615,,,,,,Accepted,Hongkang Ni,28 January,13:00,30
QIP,2026,contributed,Batched high-rate logical operations for quantum LDPC codes,,Qian Xu;Hengyun Zhou;Dolev Bluvstein;Madelyn Cain;Marcin Kalinowski;John Preskill;Mikhail D. Lukin;Nishad Maskara,California Institute of Technology;QuEra Computing Inc.;Harvard University;Harvard University;Harvard University;California Institute of Technology;Harvard University;Harvard University,"High-rate quantum LDPC (qLDPC) codes reduce space overhead by densely packing many
logical qubits into a single block of physical qubits. Here we extend such savings to computation by constructing batched fault-tolerant operations that apply the same logical gate across many code blocks in parallel. By leveraging shared physical resources to execute many logical operations in parallel, these operations realize high rates in space-time and significantly reduce computational costs. For arbitrary CSS qLDPC codes, we build batched gadgets with constant space-time overhead for (i) single-shot error correction and state preparation, (ii) code switching, and (iii) addressable Clifford gates. Using these batched gadgets we also construct parallel non-Clifford gates with low space-time cost. We outline principles for designing parallel quantum algorithms optimized for a batched architecture, and show in particular how lattice Hamiltonian dynamical simulations can be compiled efficiently. We also propose a near-term–friendly implementation using new self-dual Bivariate-Bicycle codes with high encoding rates (∼ 1/10), transversal Clifford gates, and global T gates, enabling Hamiltonian simulations with a lower space-time cost than analogous surface-code protocols and low-rate qLDPC protocols. These results open new paths toward scalable quantum computation via co-design of parallel quantum algorithms and high-rate fault-tolerant protocols.",,,,,,,Accepted,Qian Xu,29 January,16:30,30
QIP,2026,contributed,A Dobrushin condition for quantum Markov chains: Rapid mixing and conditional mutual information at high temperature,,Ainesh Bakshi;Allen Liu;Ankur Moitra;Ewin Tang,MIT;MIT;MIT;UC Berkeley,"A central challenge of quantum physics is to understand the structural properties of many-body systems, both in equilibrium and out of equilibrium. For classical systems, we have a unified perspective which connects structural properties of systems at thermal equilibrium to the Markov chain dynamics which mix to them. We lack such a perspective for quantum systems: many of the most fundamental ideas of the modern classical theory are notably absent from our quantum toolkit.

We develop a theory which brings the broad scope and flexibility of the classical theory to quantum Gibbs states at high temperature. At its core is a natural quantum analogue of Dobrushin’s condition; whenever this condition holds, a concise path-coupling argument proves rapid mixing for the corresponding Markovian evolution. The same machinery bridges dynamic and structural properties: rapid mixing yields exponential decay of CMI without restrictions on the size of the probed subsystems, resolving a central question in the theory of open quantum systems. Our key technical insight is an optimal transport viewpoint which couples the quantum dynamics to a linear differential equation, enabling precise control over how local deviations from equilibrium propagate to distant sites.",,,,,,,Accepted,,,,
QIP,2026,contributed,Free mutual information and ergodicity in operator space,,Shreya Vardhan;Jinzhao Wang,Caltech;Stanford University,"We introduce a quantity called the free mutual information (FMI), adapted from concepts in free probability theory, as a new physical measure of quantum chaos. This quantity captures the spreading of a time-evolved operator in the space of all possible operators in the Hilbert space, which is doubly exponential in the number of degrees of freedom. It thus provides a finer notion of operator spreading than the well-understood phenomenon of operator growth in physical space. We derive two central results which apply in any physical system: first, an explicit ``Coulomb gas’’ formula for the FMI in terms of the eigenvalues of the product operator $A(t)B$; and second, a general relation expressing the FMI as a weighted sum of all higher-point out-of-time-ordered correlators (OTOCs). This second result provides a precise information-theoretic interpretation for the higher-point OTOCs as collectively quantifying operator ergodicity and the approach to freeness. This physical interpretation is particularly useful in light of recent progress in experimentally measuring higher-point OTOCs. We identify universal behaviours of the FMI and higher-point OTOCs in a variety of chaotic systems, including random unitary circuits and chaotic spin chains, which indicate that spreading in the doubly exponential operator space is a generic feature of quantum many-body chaos. At the same time, the non-generic behavior of the FMI in various non-chaotic systems, including certain unitary designs, shows that there are cases where an operator spreads in physical space but remains localized in operator space. The FMI is thus a sharper diagnostic of chaos than the standard 4-point OTOC.",,,,,,,Accepted,,,,
QIP,2026,merged_contributed,An infinite hierarchy of multi-copy quantum learning tasks,,Jan Nöller;Viet Tran;Mariami Gachechildaze;Richard Kueng,TU Darmstadt;JKU Linz;TU Darmstadt;JKU Linz,"Learning properties of quantum states from measurement data is a fundamental
challenge in quantum information. The sample complexity of such tasks depends
crucially on the measurement primitive. While shadow tomography achieves sample-
efficient learning by allowing entangling measurements across many copies, it requires
prohibitively deep circuits. At the other extreme, two-copy measurements already yield
exponential advantages over single-copy strategies in tasks such as Pauli tomography.
In this work we show that such sharp separations extend far beyond the two-copy
regime: for every prime k we construct explicit learning tasks of degree k, which are
exponentially hard with (k − 1)-copy measurements but efficiently solvable with k-
copy measurements. Our protocols are not only sample-efficient but also realizable
with shallow circuits. Extending further, we show that such finite-degree tasks ex-
ist for all square-free integers k, pointing toward a general principle underlying their
existence. Together, our results reveal an infinite hierarchy of multi-copy learning prob-
lems, uncovering new phase transitions in sample complexity and underscoring the role
of reliable quantum memory as a key resource for exponential quantum advantage",,,,,,,AcceptedAsMerge,,,,
QIP,2026,contributed,Parallel Spooky Pebble Games and Regev's Factoring Algorithm,,Gregory D. Kahanamoku-Meyer;Seyoon Ragavan;Katherine Van Kirk,MIT;MIT;Harvard,"We define and study \emph{parallel spooky pebble games} in the context of carrying out an inherently sequential computation on a quantum computer, where reversibility is a concern. Previous work by Blocki, Holman, and Lee (TCC 2022) and Gidney studied the benefits offered by either parallelism or spookiness respectively; we show that these two resources can enable even more efficient guarantees when utilized in tandem. Specifically, we show that with parallelism and spookiness, a line graph of length $\ell$ can be pebbled in time $2\ell$ (which is exactly optimal) and space $\leq 2.47\log \ell$.

We show that these techniques can be applied to Regev's factoring algorithm (Journal of the ACM 2025) to obtain significant concrete improvements on previous implementations of the underlying arithmetic (Ragavan and Vaikuntanathan, CRYPTO 2024). For example, we can factor 4096-bit integers $N$ using a mod $N$ multiplication depth of 328, which outperforms the 680 required of previous variants of Regev and the 444 reported by Eker{\aa} and G{\""a}rtner (IACR Communications in Cryptology 2025) for Shor's algorithm. We believe our pebbling techniques will find applications in quantum cryptanalysis beyond integer factorization.",,,,,,,Accepted,,,,
QIP,2026,contributed,Fault-tolerant protocols through spacetime concatenation,,Yichen Xu;Arpit Dua,Cornell;Virginia Tech,"We introduce a framework called spacetime concatenation for fault-tolerant compilation of syn-
drome extraction circuits of stabilizer codes. This framework enables efficient compilation of syn-drome extraction circuits into dynamical codes through structured gadget layouts and encoding matrices, facilitating low-weight measurements while preserving logical information. This frame-work uses conditions that are sufficient for fault-tolerance of the dynamical code, including not measuring logical operators and preserving the spacetime distance. This framework goes beyond dynamical weight-reduction methods, which do not explicitly produce Floquet codes with nontrivial logical automorphisms. Using this fault-tolerant framework, we reproduce known Floquet codes such as the hon-eycomb Floquet code and the ruby lattice Floquet color code with nontrivial automorphisms and a fault-tolerant planar variant of the Floquet toric code. We also construct new explicit examples of dynamical codes, including a dynamical bivariate bicycle code and a dynamical Haah code. Be-yond constructing examples, we write a restricted equivalence relation which can be used to discuss classification and resource trade-offs of dynamical codes. Lastly, we demonstrate the adaptability of our framework to arbitrary qubit layouts and fabrication defects, making it well-suited for a hardware-first design approach.",2504.08918,,,,,,Accepted,Yichen Xu,30 January,16:00,30
QIP,2026,contributed,Hamiltonians and random unitaries,,Laura Cui;Liang Mao;Fernando Brandao;Hsin-Yuan Huang;Thomas Schuster,Caltech;Tsinghua University and Caltech;AWS Center for Quantum Computing and Caltech;Caltech and Google;Caltech and Google,"Haar-random unitaries are fundamental mathematical tools for understanding quantum many-body dynamics, yet they fail to obey basic physical constraints imposed by Hamiltonians. In this work, we explore how to reconcile random unitary models with physical constraints imposed by Hamiltonians, addressing the central question: Can we efficiently generate random unitaries while obeying Hamiltonian constraints? First, we consider the role of energy conservation in the setting where the Hamiltonian $H$ is completely known. There, we show that energy-conserving pseudorandom unitaries (PRUs) exist for random local commuting Hamiltonians, assuming quantum-secure one-way functions exist. However, we also prove that energy-conserving PRUs do not exist for some local translation-invariant Hamiltonians, even in one-dimensional systems. Furthermore, we show that determining whether energy-conserving PRUs exist for a family of Hamiltonians is undecidable. Second, we consider Hamiltonian time dynamics itself when there is incomplete knowledge of $H$. In this setting, we prove that random unitaries $e^{-iHt}$ generated from any ensemble of constant-local Hamiltonians $H$ cannot form approximate unitary designs or PRUs. This barrier vanishes when we relax locality: we construct an ensemble of polylog-local Hamiltonians $H$ that generates short-time dynamics which form both a unitary design and a PRU. Our results reveal fundamental computational barriers emerging from energy conservation constraints, highlighting the tension between common models of ergodicity and the structure of physical dynamics.",,,,,,,Accepted,Laura Cui,28 January,14:00,30
QIP,2026,contributed,"Haar random codes attain the quantum Hamming bound, approximately",,Fermi Ma;Xinyu Tan;John Wright,UC Berkeley;MIT;UC Berkeley,"We study the error correcting properties of Haar random codes, in which a $K$-dimensional code space $\bC \subseteq \C^N$ is chosen at random from the Haar distribution. Our main result is that Haar random codes can approximately correct errors up to the quantum Hamming bound,
meaning that a set of $m$ Pauli errors can be approximately corrected so long as $mK \ll N$. This is the strongest bound known for any family of quantum error correcting codes (QECs), and continues a line of work showing that approximate QECs can significantly outperform exact QECs [LNCY97,CGS05,BGG24]. Our proof relies on a recent matrix concentration result of Bandeira, Boedihardjo, and van Handel [BBV23].",,,,,,,Accepted,Fermi Ma,26 January,16:00,30
QIP,2026,contributed,Mechanisms for Quantum Advantage in Global Optimization of Nonconvex Functions,,Dylan Herman;Guneykan Ozgul;Anuj Apte;Junhyung Lyle Kim;Anupam Prakash;Jiayu Shen;Shouvanik Chakrabarti,JPMorganChase;JPMorganChase;JPMorganChase;JPMorganChase;JPMorganChase;JPMorganChase;JPMorganChase,"We introduce new theoretical mechanisms for quantum speedup in the global optimization of nonconvex functions, broadening the scope of quantum advantage beyond traditional tunneling-based explanations. By establishing a rigorous correspondence between the spectral properties of Schrödinger operators and classical Langevin diffusion, we identify regimes where a real-space adiabatic algorithm (RsAA) can significantly outperform classical stochastic gradient-based methods. Leveraging this connection and novel non-asymptotic versions of well-known semi-classical results, we provide polynomial (in the dimension $d$) runtime bounds for RsAA on rotated block-separable functions, and offer theoretical evidence that black-box classical algorithms require exponential time for optimization in these settings, thereby generalizing and formalizing prior work by Leng et al (arXiv:2311.00811). While we can design certain specialized, structure-aware classical algorithms that can efficiently optimize these functions, we further show that the quantum ground state exhibits remarkable robustness to nontrivial perturbations. Leveraging recent advances in the study of the hypercontractivity of Schr\""{o}dinger operators, we construct new families of nonconvex functions for which RsAA achieves polynomial-time optimization, whereas both off-the-shelf and structure-aware classical algorithms incur exponential computational costs.  These results provide new insight into quantum-classical separations in nonconvex optimization and highlight tractable and general pathways to advantage in this setting.",,,,,,,Accepted,Dylan Herman,26 January,14:30,30
QIP,2026,contributed,"Quantum Relative Entropy Decay Composition Yields Shallow, Unstructured k-Designs",,Nicholas Laracuente,Indiana University,"A major line of questions in quantum information and computing asks how quickly locally random circuits converge to resemble global randomness. In particular, approximate k-designs are random unitary ensembles that resemble random circuits up to their first k moments. It was recently shown that on n qudits, random circuits with slightly structured architectures converge to k-designs in depth O(log n), even on one-dimensional connectivity. It has however remained open whether the same shallow depth applies more generally among random circuit architecture and connectivity, or if the structure is truly necessary. We recall the study of exponential relative entropy decay, another topic with a long history in quantum information theory. We show that a constant number of layers of a parallel random circuit on a family of architectures including one-dimensional `brickwork' has O(1 / logn) per-layer multiplicative entropy decay. We further show that on general connectivity graphs of bounded degree, randomly placed gates achieve O(1 / nlogn)-decay (consistent with log n depth convergence). Both of these results imply that random circuit ensembles with O(polylog(n)) average depth achieve k-designs in diamond norm. Hence our results address the question of whether extra structure is truly necessary for log-depth convergence. Furthermore, the relative entropy recombination techniques might be of independent interest.",,,,,,,Accepted,Nicholas Laracuente,30 January,16:00,30
