venue,year,paper_type,title,speakers,authors,affiliations,abstract,arxiv_ids,presentation_url,video_url,youtube_id,session_name,award,notes,speaker,scheduled_date,scheduled_time,duration_minutes
QIP,2026,contributed,Information-Computation Gaps in Quantum Learning via Low-Degree Likelihood,,Sitan Chen;Weiyuan Gong;Jonas Haferkamp;Yihui Quek,Harvard University;Harvard University;Saarland University;EPFL,"In a variety of physically relevant settings for learning from quantum data, there is an established recipe for measuring polynomially many copies of that data such that the resulting measurement readouts contain enough information to reconstruct the underlying system. Yet designing protocols that can computationally efficiently extract that information remains largely an art, and there are important cases where we believe this to be impossible, that is, where there is an information-computation gap. While there is a large array of tools in the classical literature for giving evidence for average-case hardness of statistical inference problems, the corresponding tools in the quantum literature are far more limited. 
    
One such framework in the classical literature, the low-degree method, makes predictions about hardness of inference problems based on the failure of estimators given by low-degree polynomials. In this work, we extend this framework to the quantum setting and show a number of new information-computation gaps for quantum learning. 
    
We establish a general connection between state designs and low-degree hardness. We use this to obtain the first information-computation gaps for learning Gibbs states of random, sparse, non-local Hamiltonians. We also use it to prove hardness for learning random shallow quantum circuit states in a challenging model where states can be measured in adaptively chosen bases. To our knowledge, the ability to model adaptivity within the low-degree framework was open even in classical settings. In addition, we also obtain a low-degree hardness result for quantum error mitigation against strategies with single-qubit measurements.

We define a new quantum generalization of the planted biclique problem and identify the threshold at which this problem becomes computationally hard for protocols that perform local measurements. Interestingly, the complexity landscape for this problem shifts when going from local measurements to more entangled single-copy measurements.

We show average-case hardness for the ``standard'' variant of Learning Stabilizers with Noise and for agnostically learning product states.",2505.22743,,,,,,Accepted,Sitan Chen,27 January,15:00,30
QIP,2026,contributed,The firewall paradox is Wigner's friend paradox,,Ladina Hausmann;Renato Renner,ETH Zürich;ETH Zurich,"In Wigner's friend-type experiments, unlike in standard QIP setups, the participating agents are modelled as quantum systems. Recent versions of such experiments have revealed that the usual rules for combining information held by different agents are inconsistent with quantum theory. Here, we show that this insight is relevant to paradoxes in quantum gravity, such as the black hole firewall paradox. This is because their structure is similar to Wigner's friend experiments: they rely on combining knowledge of multiple agents, some of whom enter the black hole, which is treated as a quantum system.",2504.03835,,,,,,Accepted,Ladina Hausmann,30 January,13:00,30
QIP,2026,contributed,Continuous-Variable Quantum MacWilliams Identities,,Ansgar G. Burchards,Freie Universität Berlin,"We derive bounds on general continuous-variable quantum error correcting codes against the displacement noise channel. The bounds limit the distances attainable by codes and also apply in an approximate setting. Our main result is a quantum analogue of the classical Cohn-Elkies bound on sphere packing densities attainable in Euclidean space. We further derive a quantum version of Levenshtein's sphere packing bound and argue that Gottesman--Kitaev--Preskill (GKP) codes based on the $E_8$ and Leech lattices achieve optimal distances. The main technical tool is a continuous-variable version of the quantum MacWilliams identities, which we introduce. The identities relate a pair of weight distributions which can be obtained for any two trace-class operators. General properties of these weight distributions are discussed, along with several examples.",arxi,,,,,,Accepted,Ansgar G. Burchards,26 January,15:30,30
QIP,2026,contributed,Efficient Learning Implies Quantum Glassiness,,Eric Anschuetz,Caltech,"We show a relation between quantum learning theory and algorithmic hardness. We demonstrate that finding near-ground states of certain sparse disordered quantum systems is average-case hard for Lipschitz quantum algorithms if there exists an efficient, local learning algorithm---such as the classical shadows algorithm---for estimating the energy of a state of the system. A corollary of our result is that many standard quantum algorithms fail to find near-ground states of these systems, including short-time Lindbladian dynamics, short-time quantum annealing, phase estimation, and shallow-depth variational quantum algorithms. Our results are unconditional.

To achieve this, we introduce a topological property of quantum systems that we call the quantum overlap gap property (QOGP). This property is only satisfied by systems with an efficient local learning algorithm for the energy. We prove that systems which exhibit this topological property in their low-energy space are intractable for quantum algorithms whose outputs are stable under perturbations to their inputs. We then prove that the QOGP is satisfied for a sparsified variant of the quantum p-spin model, giving the first known algorithmic hardness-of-approximation result for quantum algorithms in finding the ground state of a non-stoquastic, noncommuting quantum system. Our resulting lower bound for quantum algorithms optimizing this model using Lindbladian evolution matches (up to constant factors) the best-known time lower bound for classical Langevin dynamics optimizing classical p-spin models. For this reason we suspect that finding ground states of typical quantum p-spin models using quantum algorithms is, in practice, as intractable as the classical p-spin model is for classical algorithms. Inversely, we show that the Sachdev--Ye--Kitaev (SYK) model does not exhibit the QOGP, consistent with previous evidence that the model is rapidly mixing at low temperatures.",2505.00087,,,,,,Accepted,Eric Anschuetz,27 January,16:30,30
QIP,2026,contributed,A Meta-Complexity Characterization of Minimal Quantum Cryptography,,Bruno Cavalar;Boyang Chen;Andrea Coladangelo;Matthew Gray;Zihan Hu;Zhengfeng Ji;Xingjian Li,University of Oxford;Tsinghua University;University of Washington;University of Oxford;EPFL;Tsinghua University;Tsinghua University,"We give a meta-complexity characterization of EFI pairs, which are considered the “minimal” primitive in quantum cryptography (due to their equivalence to quantum commitments and for being implied by almost all other known quantum cryptographic primitives). More precisely, we show that the existence of EFI pairs is equivalent to the following: there exists a non-uniformly samplable distribution over pure states such that the problem of estimating a certain Kolmogorov-like complexity measure is hard given a single copy. The complexity measure that we consider is a smoothed version of the algorithmic entropy notion introduced by Gács [Gác01].

A key technical step in our proof, which may be of independent interest, is to show that the existence of EFI pairs is equivalent to the existence of non-uniform single-copy secure pseudorandom state generators (nu 1-PRS). As a corollary, we get an alternative, arguably simpler, construction of a universal EFI pair.",,,,,,,Accepted,Bruno Cavalar,27 January,15:30,30
QIP,2026,contributed,"On One-Shot Signatures, Quantum vs Classical Binding, and Obfuscating Permutations",,Omri Shmueli;Mark Zhandry,NTT Research;NTT Research & Stanford University,"One-shot signatures (OSS) were defined by Amos, Georgiou, Kiayias, and Zhandry (STOC'20). These allow for signing exactly one message, after which the signing key self-destructs, preventing a second message from ever being signed. While such an object is impossible classically, Amos et al observe that OSS may be possible using quantum signing keys by leveraging the no-cloning principle. OSS has since become an important conceptual tool with many applications in decentralized settings and for quantum cryptography with classical communication. OSS are also closely related to separations between classical-binding and collapse-binding for post-quantum hashing and commitments. Unfortunately, the only known OSS construction due to Amos et al. was only justified in a classical oracle model, and moreover their justification was ultimately found to contain a fatal bug. Thus, the existence of OSS, even in a classical idealized model, has remained open. 

We give the first standard-model OSS, with provable security assuming (sub-exponential) indistinguishability obfuscation (iO) and LWE. This also gives the first standard-model separation between classical and collapse-binding post-quantum commitments/hashing, solving a decade-old open problem. Along the way, we also give the first construction with unconditional security relative to a classical oracle. To achieve our standard-model construction, we develop a notion of permutable pseudorandom permutations (permutable PRPs), and show how they are useful for translating oracle proofs involving random permutations into obfuscation-based proofs. In particular, obfuscating permutable PRPs gives a trapdoor one-way permutation that is \emph{full-domain}, solving another decade-old-problem of constructing this object from (sub-exponential) iO and one-way functions.",https://arxi,,,,,,Accepted,Omri Shmueli,29 January,15:30,30
QIP,2026,contributed,Tight and self-testing multipartite quantum Bell inequalities from the renormalization group,,Paolo Abiuso;Julian Fischer;Miguel Navascues,IQOQI - Vienna;Johannes Kepler University Linz;IQOQI - Vienna,"Attempts to understand multipartite quantum nonlocality are thwarted by the difficulty of devising quantum Bell inequalities (QBI) for systems composed of more than a few separate parties. In this work, we introduce the notion of ``tight connectors"", a class of tensors which, if contracted according to some simple rules, result in tight QBIs. The new inequalities are saturated by tensor network states, whose structure mimics the corresponding network of connectors. Some tight connectors are furthermore ``fully self-testing'', which implies that the QBI they generate through contractions can only be maximized with such a tensor network state and specific measurement operators (modulo local isometries). We provide large analytic families of tight, fully self-testing connectors that allow the generation, via contraction, of N-partite QBIs with a ratio between the maximum quantum and classical values that grows exponentially with N. In turn, our method provides a modular recipe for the generation of extremal quantum behaviours and associated tight bounds in arbitrarily large systems.",2503.03878,,,,,,Accepted,Paolo Abiuso,29 January,15:00,30
QIP,2026,merged_contributed,Quantum Computational Entropies,,Noam Avidan;Thomas A. Hahn;Rotem Arnon;Joseph M. Renes,"Weizmann Institute of Science;Weizmann Institute of Science;Weizmann Institute of Science;Institute for Theoretical Physics, ETH Zurich","Quantum information theory, particularly its entropic formulations, has made remarkable strides in characterizing quantum systems and tasks. However, a critical dimension remains underexplored: computational efficiency. While classical computational entropies integrate complexity and feasibility into information measures, analogous concepts have yet to be rigorously developed in the quantum setting. In this joint submission, we advance a quantum computational information theory through two complementary works. The first introduces the quantum computational unpredictability entropy, a natural generalization of the min entropy for classical-quantum states and of the classical unpredictability entropy that quantifies the guessing probability of classical randomness using quantum side information and bounded computational power. The second work extends this to the fully quantum setting by defining fully quantum computational min- and max-entropies. The computational min-entropy generalizes unpredictability entropy and retains essential properties, including data processing, a fully quantum leakage chain rule, and it satisfies a novel purification chain rule. The computational max-entropy is defined via a canonical duality relation and it captures a notion of efficient entanglement distillation under bounded quantum circuits. With the introduction of these computational entropies and their analysis, this work marks a critical step toward a quantum information theory that incorporates computational elements.","2505.13710, 2506.14068",,,,,,AcceptedAsMerge,,,,
QIP,2026,contributed,Parent Lindbladians for Matrix Product Density Operators,,Yuhan Liu;Alberto Ruiz-de-Alarcon;Georgios Styliaris;Xiao-Qi Sun;David Perez-Garcia;Ignacio Cirac,"Max Planck Institute of Quantum Optics;Universidad Complutense de Madrid, CUNEF Universidad;Max Planck Institute of Quantum Optics;Max Planck Institute of Quantum Optics;Universidad Complutense de Madrid, nstituto de Ciencias Matematicas;Max Planck Institute of Quantum Optics","Understanding quantum phases of matter is a fundamental goal in physics. For pure states, the representatives of phases are the ground states of locally interacting Hamiltonians, which are also renormalization fixed points (RFPs). These RFP states are exactly described by tensor networks. Extending this framework to mixed states, matrix product density operators (MPDOs) which are RFPs are believed to encapsulate mixed-state phases of matter in one dimension, where non-trivial topological phases have already been shown to exist. However, to better motivate the physical relevance of those states, and in particular the physical relevance of the recently found non-trivial phases, it remains an open question whether such MPDO RFPs can be realized as steady states of local Lindbladians. In this work, we resolve this question by analytically constructing parent Lindbladians for MPDO RFPs. These Lindbladians are local, frustration-free, and exhibit minimal steady-state degeneracy. Interestingly, we find that parent Lindbladians possess a rich structure that distinguishes them from their Hamiltonian counterparts. In particular, we uncover an intriguing connection between the non-commutativity of the Lindbladian terms and the fact that the corresponding MPDO RFP belongs to a non-trivial phase.",2501.10552,,,,,,Accepted,Yuhan Liu,27 January,13:30,30
QIP,2026,contributed,Cyclic quantum causal modelling with a graph separation theorem,,Carla Ferradini;Victor Gitton;V. Vilasini,"Institute for Theoretical Physics, ETH Zurich;Institute for Theoretical Physics, ETH Zurich;Inria University Grenoble Alpes","Causal modelling frameworks link observable correlations to causal explanations, which is a crucial aspect of science. These models represent causal relationships through directed graphs, with vertices and edges denoting systems and transformations within a theory. Most studies focus on acyclic causal graphs, where well-defined probability rules and powerful graph-theoretic properties like the d-separation theorem apply. However, understanding complex feedback processes and exotic fundamental scenarios with causal loops requires cyclic causal models, where such results do not generally hold. While progress has been made in classical cyclic causal models, challenges remain in uniquely fixing probability distributions and identifying graph-separation properties applicable in general cyclic models. In cyclic quantum scenarios, existing frameworks have focussed on a subset of possible cyclic causal scenarios, with graph-separation properties yet unexplored. This work proposes a framework applicable to all consistent quantum and classical cyclic causal models on finite-dimensional systems. We address these challenges by introducing a robust probability rule and a novel graph-separation property, p-separation, which we prove to be sound and complete for all such models. Our approach maps cyclic causal models to acyclic ones with post-selection, leveraging the post-selected quantum teleportation protocol. We characterize these protocols and their success probabilities along the way. We also establish connections between this formalism and other classical and quantum frameworks to inform a more unified perspective on causality. This provides a foundation for more general cyclic causal discovery algorithms and to systematically extend open problems and techniques from acyclic informational networks (e.g., certification of non-classicality) to cyclic causal structures and networks.",2502.04168,,,,,,Accepted,Carla Ferradini,26 January,14:00,30
QIP,2026,contributed,"Cloning Games, Black Holes and Cryptography",,Alexander Poremba;Seyoon Ragavan;Vinod Vaikuntanathan,Boston University;MIT;MIT,"In this work, we introduce a new toolkit for analyzing \emph{cloning games}, a notion that captures stronger and more quantitative versions of the celebrated quantum no-cloning theorem. This framework allows us to analyze a new cloning game based on \emph{binary phase states}. Our results provide evidence that these games may be able to overcome important limitations of previous candidates based on BB84 states and subspace coset states: in a model where the adversaries are restricted to making a single oracle query, we show that the binary phase variant is $t$-copy secure when $t=o(n/\log n)$. Moreover, for constant $t$, we obtain the \emph{first} optimal bounds of $O(2^{-n})$, asymptotically matching the value attained by a trivial adversarial strategy. We also show a worst-case to average-case reduction which allows us to show the same quantitative results for the new and natural notion of \emph{Haar cloning games}.

Our analytic toolkit, which we believe will find further applications, is based on binary subtypes and uses novel bounds on the operator norms of block-wise tensor products of matrices. To illustrate the effectiveness of these new techniques, we present two applications: first, in black-hole physics, where our asymptotically optimal bound offers quantitative insights into information scrambling in idealized models of black holes; and second, in unclonable cryptography, where we (a) construct succinct unclonable encryption schemes from the existence of pseudorandom unitaries, and (b) propose and provide evidence for the security of multi-copy unclonable encryption schemes.",2411.04730,,,,,,Accepted,Alexander Poremba,30 January,13:30,30
QIP,2026,contributed,The abelian state hidden subgroup problem: Learning stabilizer groups and beyond,,Marcel Hinsche;Jose Carrasco;Jens Eisert,Freie Universität Berlin;Freie Universität Berlin;Freie Universität Berlin,"Identifying the symmetry properties of quantum states is a central theme in quantum information theory and quantum many-body physics. In this work, we investigate quantum learning problems in which the goal is to identify a hidden symmetry of an unknown quantum state. Building on the recent formulation of the state hidden subgroup problem (StateHSP), we focus on abelian groups and develop an efficient quantum algorithm that learns any hidden symmetry subgroup using a generalized form of Fourier sampling. We showcase the versatility of the approach in three concrete applications: These are learning (i) qubit and qudit stabilizer groups, (ii) cuts along which a state is unentangled, and (iii) hidden translation symmetries. Through these applications, we reveal that well-known quantum learning primitives, such as Bell sampling and Bell difference sampling, are in fact special cases of Fourier sampling. Our results highlight the broad potential of the StateHSP framework for symmetry-based quantum learning tasks.",2505.15770,,,,,,Accepted,Marcel Hinsche,29 January,13:00,30
QIP,2026,contributed,The Jacobi Factoring Circuit: Quantum Factoring in Near-Linear Gates and Sublinear Space,,Gregory D. Kahanamoku-Meyer;Seyoon Ragavan;Vinod Vaikuntanathan;Katherine Van Kirk,MIT;MIT;MIT;Harvard,"We present a compact quantum circuit for factoring a large class of integers, including some whose classical hardness is expected to be equivalent to RSA (but not including RSA integers themselves). Most notably, we factor $n$-bit integers of the form $P^2 Q$ with $\log Q = \Theta(n^a)$ for $a \in (2/3, 1)$ in space and depth sublinear in n (specifically, $\widetilde{O}(\log Q)$) using $\widetilde{O}(n)$ quantum gates; for these integers, no known classical algorithms exploit the relatively small size of $Q$ to run asymptotically faster than general-purpose factoring algorithms. To our knowledge, this is the first polynomial-time circuit to achieve sublinear qubit count for a classically-hard factoring problem. We thus believe that factoring such numbers has potential to be the most concretely efficient classically-verifiable proof of quantumness currently known.
 
Our circuit builds on the quantum algorithm for squarefree decomposition discovered by Li, Peng, Du, and Suter (Nature Scientific Reports 2012), which relies on computing the Jacobi symbol in quantum superposition. The technical core of our contribution is a new space-efficient quantum algorithm to compute the Jacobi symbol of $A$ mod $B$, in the regime where $B$ is classical and much larger than $A$. Our circuit for computing the Jacobi symbol generalizes to related problems such as computing the greatest common divisor and modular inverses, and thus could be of independent interest.",2412.12558,,,,,,Accepted,Gregory D. Kahanamoku-Meyer,29 January,13:00,60
QIP,2026,contributed,Quantum Advantage from Sampling Shallow Circuits: Beyond Hardness of Marginals,,Daniel Grier;Daniel M. Kane;Jackson Morris;Anthony Ostuni;Kewen Wu,UC San Diego;UC San Diego;UC San Diego;UC San Diego;Institute for Advanced Study,"We construct a family of distributions $\{\mathcal{D}_n\}_n$ with $\mathcal{D}_n$ over $\{0,1\}^n$ and a family of depth-$7$ quantum circuits $\{C_n\}_n$ such that $\mathcal{D}_n$ is produced exactly by $C_n$ with the all zeros state as input, yet any constant-depth classical circuit with bounded fan-in gates evaluated on any binary product distribution has total variation distance $1 - e^{-\Omega(n)}$ from $\mathcal{D}_n$. Moreover, the quantum circuits we construct are geometrically local and use a relatively standard gate set: Hadamard, controlled-phase, CNOT, and Toffoli gates. All previous separations of this type suffer from some undesirable constraint on the classical circuit model or the quantum circuits witnessing the separation.
    
Our family of distributions is inspired by the Parity Halving Problem of Watts, Kothari, Schaeffer, and Tal (STOC, 2019), which built on the work of Bravyi, Gosset, and K\""onig (Science, 2018) to separate shallow quantum and classical circuits for relational problems.",,,,,,,Accepted,Daniel Grier,30 January,10:00,30
QIP,2026,merged_contributed,Computational aspects of the trace norm contraction coefficient,,Idris Delsol;Omar Fawzi;Jan Kochanowski;Akshay Ramachandran,"Inria, ENS Lyon;Inria, ENS Lyon;Inria, Télécom Paris - LTCI, Institut Polytechnique de Paris;Inria, ENS Lyon","We show that approximating the trace norm contraction coefficient of a quantum channel within a constant factor is NP-hard. Equivalently, this shows that determining the optimal success probability for encoding a bit in a quantum system undergoing noise is NP-hard. This contrasts with the classical analogue of this problem that can clearly be solved efficiently. Our hardness results also hold for deciding if the contraction coefficient is equal to 1. As a consequence, we show that deciding if a non-commutative graph has an independence number of at least 2 is NP-hard. In addition, we establish a converging hierarchy of semidefinite programming upper bounds on the contraction coefficient.",2507.16737,,,,,,AcceptedAsMerge,,,,
