venue,year,paper_type,title,speakers,authors,affiliations,abstract,arxiv_ids,presentation_url,video_url,youtube_id,session_name,award,notes,speaker,scheduled_date,scheduled_time,duration_minutes
QIP,2026,contributed,Uncloneable Encryption from Decoupling,,Archishna Bhattacharyya;Eric Culf,University of Ottawa;University of Waterloo,"We show for the first time that uncloneable encryption exists with no computational assumptions, with security inverse-polynomial in the security parameter. We use properties of a monogamy-of-entanglement game associated with the Haar measure encryption to guarantee that any state that succeeds with high probability cannot be close to maximally-entangled between the referee and either of the players, whence we can apply the decoupling principle to show that either player becomes completely uncorrelated, and therefore cannot win significantly better than random guessing.",2503.19125,,,,,,Accepted,Archishna Bhattacharyya,28 January,13:00,30
QIP,2026,contributed,A Quantum Approach For Reducing Communications in Classical Secure Computations with Long Outputs,,Jiayu Zhang,Zhongguancun Laboratory,"How could quantum cryptography help us achieve what are not achievable in classical cryptography? In this work we study the classical cryptographic problem that two parties would like to perform secure computations with long outputs. As a basic primitive and example, we first consider the following problem which we call secure function sampling with long outputs: suppose $f:\{0,1\}^n\rightarrow \{0,1\}^m$ is a public, efficient classical function, where $m$ is big; Alice would like to sample $x$ from its domain and sends $f(x)$ to Bob; what Bob knows should be no more than $f(x)$ even if it behaves maliciously. Classical cryptography, like FHE and succinct arguments [Gen09,Kil92,HW15], allows us to achieve this task within communication complexity $O(n+m)$; could we achieve this task with communication complexity independent of $m$?

In this work, we first design a quantum cryptographic protocol that achieves secure function sampling with approximate security, within $O(n)$ communication (omitting the dependency on the security parameter and error tolerance). We also prove the classical impossibility using techniques in [HW15], which means that our protocol indeed achieves a type of quantum advantage. Building on the secure function sampling protocol, we further construct protocols for general secure two-party computations [Yao86,GB01] with approximate security, with communication complexity only depending on the input length and the targeted security. In terms of the assumptions, we construct protocols for these problems assuming only the existence of collapsing hash functions [Unr16]; what's more, we also construct a classical-channel protocol for these problems additionally assuming the existence of noisy trapdoor claw-free functions [BCMVV,BKVV].",2310.05213,,,,,,Accepted,Jiayu Zhang,27 January,15:00,30
QIP,2026,contributed,Fault Tolerance by Construction,,Benjamin Rodatz;Boldizsár Poór;Maximilian Rüsch;Aleks Kissinger,University of Oxford;University of Oxford;University of Oxford;University of Oxford,"A key challenge in fault-tolerant quantum computing is synthesising and optimising circuits in a noisy environment, as traditional techniques often fail to account for the effect of noise on circuits. In this work, we propose a framework for designing fault-tolerant quantum circuits that are correct by construction. The framework starts with idealised specifications of fault-tolerant gadgets and refines them using provably sound basic transformations.

To reason about manipulating circuits while preserving their error correction properties, we define fault equivalence; two circuits are considered fault-equivalent if all undetectable faults on one circuit have a corresponding fault on the other. This guarantees that the effect of undetectable faults on both circuits is the same. We argue that fault equivalence is a concept that is already implicitly present in the literature. Many problems, such as state preparation and syndrome extraction, can be naturally expressed as finding an implementable circuit that is fault-equivalent to an idealised specification.

To utilise fault equivalence in a computationally tractable manner, we adapt the ZX calculus, a diagrammatic language for quantum computing. We restrict its rewrite system to not only preserve the underlying linear map but also fault equivalence, i.e. the circuit's behaviour under noise. We show that this rewriting system is complete, meaning that two circuits are fault-equivalent if and only if one can be transformed into the other using fault-equivalent ZX rewrites. Enabled by our framework, we verify, optimise and synthesise new and efficient circuits for syndrome extraction and cat state preparation. We anticipate that fault equivalence can capture and unify different approaches in fault-tolerant quantum computing, paving the way for an end-to-end circuit compilation framework.","2506.17181,https://maximilianruesch.de/scientific/msc-thesis/msc-thesis.pdf",,,,,,Accepted,Benjamin Rodatz,30 January,15:00,30
QIP,2026,contributed,Parallel Repetition for Post-Quantum Arguments,,Andrew Huang;Yael Tauman Kalai,Massachusetts Institute of Technology;Massachusetts Institute of Technology,"In this work, we prove that parallel repetition of public-coin interactive arguments reduces the soundness error at an exponential rate even in the post-quantum setting. Moreover, we generalize this result to hold for threshold verifiers, where the parallel repeated verifier accepts if and only if at least t of the executions are accepted (for some threshold t). Prior to this work, these results were known only when the cheating prover is assumed to be classical.

We also prove a similar result for three-message private-coin arguments. Previously, Bostanci, Qian, Spooner, and Yuen (STOC 2024) proved such a parallel repetition result in the more general setting of quantum protocols, where the communication may be quantum. We consider only protocols where the verifier is classical, but obtain a more simplified analysis, and for the more general setting of threshold verifiers.",2506.02277,,,,,,Accepted,Andrew Huang,29 January,15:00,30
QIP,2026,contributed,Quantum circuit lower bounds in the magic hierarchy,,Natalie Parham,Columbia University,"We introduce the \emph{magic hierarchy}, a quantum circuit model that alternates between arbitrary-sized Clifford circuits and constant-depth circuits with two-qubit gates ($\textsf{QNC}^0$). This model unifies existing circuit models, such as $\QACZF$ and models with adaptive intermediate measurements. Despite its generality, we are able to prove nontrivial lower bounds.

We prove new lower bounds in the first level of the hierarchy, showing that certain explicit quantum states cannot be approximately prepared by circuits consisting of a Clifford circuit followed by $\textsf{QNC}^0$. These states include ground states of some topologically ordered Hamiltonians and nonstabilizer quantum codes. Our techniques exploit the rigid structure of stabilizer codes and introduce an infectiousness property: if even a single state in a high distance code can be approximately prepared by one of these circuits, then the entire subspace must lie close to a perturbed stabilizer code. We also show that proving state preparation lower bounds beyond a certain level of the hierarchy would imply \emph{classical} circuit lower bounds beyond the reach of current techniques in complexity theory. 

More broadly, our techniques go beyond lightcone-based methods and highlight how the magic hierarchy provides a natural framework for connecting circuit complexity, condensed matter, and Hamiltonian complexity.",https://arxi,,,,,,Accepted,Natalie Parham,28 January,13:30,30
QIP,2026,plenary_short,Few Single-Qubit Measurements Suffice to Certify Any Quantum State,,Meghal Gupta;William He;Ryan O'Donnell,UC Berkeley;Carnegie Mellon University;Carnegie Mellon University,"A fundamental task in quantum information science is \emph{state certification}: testing whether a lab-prepared $n$-qubit state is close to a given hypothesis state. In this work, we show that \emph{every} pure hypothesis state can be certified using only $O(n^2)$ single-qubit measurements applied to $O(n)$ copies of the lab state. Prior to our work, it was not known whether even subexponentially many single-qubit measurements could suffice to certify arbitrary states. This resolves the main open question of Huang, Preskill, and Soleimanifar (FOCS 2024, QIP 2024).

Our algorithm also showcases the power of \emph{adaptive measurements}: within each copy of the lab state,  previous measurement outcomes dictate how subsequent qubit measurements are made. We show that the adaptivity is necessary, by proving an exponential lower bound on the number of copies needed for any nonadaptive single-qubit measurement algorithm.",2506.11355,,,,,Best Student Paper,AcceptedAsPlenaryAndBestStudentPaper,William He,28 January,10:00,30
QIP,2026,contributed,Unified Framework for Quantum Code Embedding,,Andrew C. Yuan,"University of Maryland, College Park","Given a Calderbank-Shor-Steane (CSS) code, it is sometimes necessary to modify the code by adding an arbitrary number of physical qubits and parity checks.
Motivations may include concatenating codes, embedding low-density parity check (LDPC) codes into finite-dimensional Euclidean space, or reducing the weights of parity checks.
During this embedding, it is essential that the modified code possesses an isomorphic set of logical qubits as the original code. 
However, despite numerous explicit constructions, the conditions of when such a property holds true is not known in general.
Therefore, using the language of homological algebra, we provide a unified framework that guarantees a natural isomorphism between the output and input codes.
In particular, we explicitly show how previous works fit into our framework.",2507.05361,,,,,,Accepted,Andrew C. Yuan,26 January,16:30,30
QIP,2026,contributed,High-Temperature Fermionic Gibbs States are Mixtures of Gaussian States,,Akshar Ramkumar;Yiyi Cai;Yu Tong;Jiaqing Jiang,"California Institute of Technology;California Institute of Technology;Duke University;California Institute of Technology & University of California, Berkeley","Efficient simulation of a quantum system generally relies on structural properties of the quantum state. Motivated by the recent results by Bakshi et al. on the sudden death of entanglement in high-temperature Gibbs states of quantum spin systems, we study the high-temperature Gibbs states of bounded-degree local fermionic Hamiltonians, which include the special case of geometrically local fermionic systems.  We prove that at a sufficiently high temperature that is independent of the system size, the Gibbs state is a probabilistic mixture of fermionic Gaussian states. This forms the basis of an efficient classical algorithm to prepare the Gibbs state by sampling from a distribution of fermionic Gaussian states. As a contrasting example, we show that high-temperature Gibbs states of the Sachdev-Ye-Kitaev (SYK) model are not convex mixtures of Gaussian states.",2505.09730,,,,,,Accepted,Akshar Ramkumar,27 January,13:00,30
QIP,2026,contributed,On the Cryptographic Foundations of Interactive Quantum Advantage,,Kabir Tomer;Mark Zhandry,University of Illinois Urbana-Champaign;Stanford University,"In this work, we study the hardness required to achieve proofs of quantumness (PoQ), which in turn capture (potentially interactive) quantum advantage. A ``trivial'' PoQ is to simply assume an average-case hard problem for classical computers that is easy for quantum computers. However, there is much interest in ``non-trivial'' PoQ that actually rely on quantum hardness assumptions, as these are often a starting point for more sophisticated protocols such as classical verification of quantum computation (CVQC). We show several lower-bounds for the hardness required to achieve non-trivial PoQ, in particular showing that they likely require cryptographic hardness, with different types of cryptographic hardness being required for different variations of non-trivial PoQ. In particular, our results help explain the challenges in using lattices to build publicly verifiable PoQ and its various extensions such as CVQC.",,,,,,,Accepted,Kabir Tomer,27 January,16:30,30
QIP,2026,contributed,Catalytic z-rotations in constant T-depth,,Isaac Kim,UC Davis,"We show that the $T$-depth of any single-qubit $z$-rotation can be reduced to $3$ if a certain catalyst state is available. To achieve an $\epsilon$-approximation, it suffices to have a catalyst state of size polynomial in $\log(1/\epsilon)$.  This implies that $\mathsf{QNC}^0_f/\mathsf{qpoly}$ admits a finite universal gate set consisting of Clifford+$T$. In particular, there are catalytic constant $T$-depth circuits that approximate multi-qubit Toffoli, adder, and quantum Fourier transform arbitrarily well. We also show that the catalyst state can be prepared in time polynomial in  $\log (1/\epsilon)$.",2506.15147,,,,,,Accepted,,,,
QIP,2026,contributed,Causal decompositions of 1D quantum cellular automata,,Augustin Vanrietvelde;Octave Mestoudjian;Pablo Arrighi,Télécom Paris -- Institut Polytechnique de Paris;Université Paris-Saclay;Inria Saclay,"Understanding quantum theory's causal structure stands out as a major matter, since it radically departs from classical notions of causality. We present advances in the research program of causal decompositions, which investigates the existence of an equivalence between the causal and the compositional structures of unitary channels. Our results concern one-dimensional Quantum Cellular Automata (1D QCAs), i.e.\ unitary channels over a line of N quantum systems (with or without periodic boundary conditions) that feature a causality radius r: a given input cannot causally influence outputs at a distance more than r. We prove that, for N ≥ 4r + 1, 1D QCAs all admit causal decompositions: a unitary channel is a 1D QCA if and only if it can be decomposed into a unitary routed circuit of nearest-neighbour interactions, in which its causal structure is compositionally obvious. This provides the first constructive form of 1D QCAs with causality radius one or more, fully elucidating their structure. In addition, we show that this decomposition can be taken to be translation-invariant for the case of translation-invariant QCAs. Our proof of these results makes use of innovative algebraic techniques, leveraging a new framework for capturing partitions into non-factor sub-C* algebras.",2506.22219,,,,,,Accepted,Augustin Vanrietvelde,26 January,13:30,30
QIP,2026,contributed,Fourier Spectrum of Noisy Quantum Algorithms,,Uma Girish,Columbia University,"Quantum computing promises exponential speedups for certain problems, yet fully universal quantum computers remain out of reach and near-term devices are inherently noisy. Motivated by this, we study noisy quantum algorithms and the landscape between BQP and BPP. We build on a powerful technique to differentiate quantum and classical algorithms called the level-$\ell$ Fourier growth (the sum of absolute values of Fourier coefficients of sets of size $\ell$) and show that it can also be used to differentiate quantum algorithms based on the types of resources used. We show that noise acting on a quantum algorithm dampens its Fourier growth in ways intricately linked to the type of noise.

Concretely, we study noisy models of quantum computation where highly mixed states are prevalent, namely: DQC_k algorithms, where k qubits are clean and the rest are maximally mixed, and 1/2-BQP algorithms, where the initial state is maximally mixed, but the algorithm is given knowledge of the initial state at the end of the computation. We establish upper bounds on the Fourier growth of DQC_k, 1/2-BQP and BQP algorithms and leverage the differences between these bounds to derive oracle separations between these models. In particular, we show that the 2-Forrelation and 3-Forrelation problems require $N^{\Omega(1)}$ queries in the DQC_1 and 1/2-BQP models respectively. Our results are proved using a new matrix decomposition lemma that might be of independent interest.",,,,,,,Accepted,Uma Girish,26 January,14:00,30
QIP,2026,contributed,Efficient and simple Gibbs sampling state preparation of the 2D toric code via duality to classical Ising chains,,Pablo Páez Velasco;Niclas Schilling;Samuel O. Scalet;Frank Verstraete;Ángela Capel,Universidad Complutense de Madrid / ICMAT;University of Tübingen;University of Cambridge / IBM;University of Cambridge / Ghent University;University of Cambridge / University of Tübingen,"We introduce the notion of polynomial-depth duality transformations, which relates two sets of operator algebras through a conjugation by a poly-depth quantum circuit, and make use of this to construct efficient Gibbs samplers for a variety of interesting quantum Hamiltonians as they are poly-depth dual to classical Hamiltonians. This is for example the case for the 2D toric code, which is demonstrated to be poly-depth dual to two decoupled classical Ising spin chains for any system size, and we give evidence that such dualities hold for a wide class of stabilizer Hamiltonians.  Additionally, we extend the above notion of duality to Lindbladians in order to show that mixing times and other quantities such as the spectral gap or the modified logarithmic Sobolev inequality are preserved under duality.",2508.00126,,,,,,Accepted,,,,
QIP,2026,contributed,Random Unitaries in Constant (Quantum) Time,,Benjamin Foxman;Natalie Parham;Francisca Vasconcelos;Henry Yuen,Yale University;Columbia University;UC Berkeley;Columbia University,"Random unitaries are a central object of study in quantum information, with applications to quantum computation, quantum many-body physics, and quantum cryptography. Recent work has constructed unitary designs and pseudorandom unitaries (PRUs) using $\Theta(\log \log n)$-depth unitary circuits with two-qubit gates. 

   In this work, we show that unitary designs and PRUs can be efficiently constructed in several well-studied models of \emph{constant-time} quantum computation (i.e., the time complexity on the quantum computer is independent of the system size). These models are constant-depth circuits augmented with certain nonlocal operations, such as (a) many-qubit TOFFOLI gates, (b) many-qubit FANOUT gates, or (c) mid-circuit measurements with classical feedforward control. Recent advances in quantum computing hardware suggest experimental feasibility of these models in the near future. 

   Our results demonstrate that unitary designs and PRUs can be constructed in much weaker circuit models than previously thought. 
   Furthermore, our construction of PRUs in constant-depth with many-qubit TOFFOLI gates shows that, under cryptographic assumptions, there is no polynomial-time learning algorithm for the circuit class $\mathsf{QAC^0}$. Finally, our results suggest a new approach towards proving that PARITY is not computable in $\mathsf{QAC^0}$, a long-standing question in quantum complexity theory.",2508.11487,,,,,,Accepted,Benjamin Foxman,26 January,13:30,30
QIP,2026,contributed,Can effective descriptions of bosonic systems be considered complete?,,Francesco Arzani;Robert Booth;Ulysse Chabaud,ENS - INRIA;University of Oxford;ENS - INRIA,"Bosonic statistics give rise to remarkable phenomena, from the Hong-Ou-Mandel effect to Bose-Einstein condensation, with applications spanning fundamental science to quantum technologies.  Modelling bosonic systems relies heavily on effective descriptions: typically, truncating their infinite-dimensional state space or restricting their dynamics to a simple class of Hamiltonians, such as polynomials of canonical operators. However, many natural bosonic Hamiltonians do not belong to these simple classes, and some quantum effects harnessed by bosonic computers inherently require infinite-dimensional spaces. Can we trust  results obtained with such simplifying assumptions to capture real effects?

We solve this outstanding problem, showing that these effective descriptions do correctly capture the physics of bosonic systems. Our technical contributions are twofold: first, we prove that any physical bosonic unitary evolution can be accurately approximated by a finite-dimensional unitary evolution; second, we show that any finite-dimensional unitary evolution can be generated exactly by a bosonic Hamiltonian that is a polynomial of canonical operators. Beyond their fundamental significance, our results have implications for classical and quantum simulations of bosonic systems, provide universal methods for engineering bosonic quantum states and Hamiltonians, show that polynomial Hamiltonians generate universal gate sets for quantum computing over bosonic modes, and lead to a bosonic Solovay-Kitaev theorem.",2501.13857,,,,,,Accepted,Francesco Arzani,27 January,13:00,30
QIP,2026,contributed,Tile codes,,Vincent Steffan;Shin Ho Choe;Nikolas P. Breuckmann;Francisco Revson Fernandes Pereira;Jens Niklas Eberhardt;Zijian Liang;Yu-An Chen,IQM Germany;IQM Germany;Breuqmann Ltd.;IQM Germany;Johannes Gutenberg-Universität Mainz;Peking University;Peking University,"We introduce tile codes, a simple yet powerful way of constructing quantum codes that are local on a planar 2D-lattice. Tile codes generalize the usual surface code by allowing for a bit more flexibility in terms of locality and stabilizer weight. Our construction does not compromise on the fact that the codes are local on a lattice with open boundary conditions. Despite its simplicity, we use our construction to find codes with parameters [[288,8,12]] using weight-6 stabilizers and [[288,8,14]] using weight-8 stabilizers, outperforming all previously known constructions in this direction. Allowing for a slightly higher non-locality, we find a [[512,18,19]] code using weight-8 stabilizers, which outperforms the rotated surface code by a factor of more than 12. Our approach provides a unified framework for understanding the structure of codes that are local on a 2D planar lattice and offers a systematic way to explore the space of possible code parameters. In particular, due to its simplicity, the construction naturally accommodates various types of boundary conditions and stabilizer configurations, making it a versatile tool for quantum error correction code design.","https://doi.org/10.1103/l4mx-l3xx, https://arxi",,,,,,Accepted,Vincent Steffan,26 January,17:00,30
QIP,2026,contributed,Unfolded distillation: very low-cost magic state preparation for biased-noise qubits,,Diego Ruiz;Jérémie Guillaud;Christophe Vuillot;Mazyar Mirrahimi,Inria - Alice&Bob;Alice&Bob;Alice&Bob;Inria,"Magic state distillation enables universal fault-tolerant quantum computation by implementing non-Clifford gates via the preparation of high-fidelity magic states. However, it comes at the cost of substantial logical-level overhead in both space and time. In this work, we propose a very low-cost magic state distillation scheme for biased-noise qubits. By leveraging the noise bias, our scheme enables the preparation of a magic state with a logical error rate of 3×10^(−7), using only 53 qubits and 5.5 error correction rounds, under a noise bias of η ≳ 5×10^6 and a phase-flip noise rate of 0.1%. This reduces the circuit volume by more than one order of magnitude relative to magic state cultivation for unbiased-noise qubits and by more than two orders of magnitude relative to standard magic state distillation. Moreover, our scheme provides three key advantages over previous proposals for biased-noise qubits. First, it only requires nearest-neighbor two-qubit gates on a 2D lattice. Second, the logical fidelity remains nearly identical even at a more modest noise bias of η ≳ 80, at the cost of a slightly increased circuit volume. Third, the scheme remains effective even at high physical phase-flip rates, in contrast to previously proposed approaches whose circuit volume grows exponentially with the error rate. Our construction is based on unfolding the X stabilizer group of the Hadamard 3D quantum Reed-Muller code in 2D, enabling distillation at the physical level rather than the logical level, and is therefore referred to as unfolded distillation.",https://arxi,,,,,,Accepted,Diego Ruiz,27 January,15:00,30
QIP,2026,contributed,Obfuscation of Unitary Quantum Programs,,Miryam Mi-Ying Huang;Er-Cheng Tang,University of Southern California;University of Washington,"Program obfuscation aims to hide the inner workings of a program while preserving its functionality. In the quantum setting, recent works have obtained obfuscation schemes for specialized classes of quantum circuits. For instance, Bartusek, Brakerski, and Vaikuntanathan (STOC 2024) constructed a quantum state obfuscation scheme, which supports the obfuscation of quantum programs represented as quantum states for pseudo-deterministic quantum programs with classical inputs and outputs in the classical oracle model.

In this work, we improve upon existing results by constructing the first quantum state obfuscation scheme for unitary (or approximately unitary) quantum programs supporting quantum inputs and outputs in the classical oracle model. At the core of our obfuscation scheme are two novel ingredients: a functional quantum authentication scheme that allows key holders to learn specific functions of the authenticated quantum state with simulation-based security, and a compiler that represents an arbitrary quantum circuit as a projective linear-plus-measurement quantum program described by a sequence of non-adaptive Clifford gates interleaved with adaptive and compatible measurements.",2507.11970,,,,,,Accepted,,,,
